issue,id,reporter,closed_by,created_at,updated_at,closed_at,state,assignee,milestone,comments,label_name,url,title,body
1737,10627187,dougalsutherland,mdboom,2013-02-04 21:45:51,2013-05-20 19:37:21,2013-05-20 19:37:21,closed,dmcdougall,v1.3.x blocker,8,confirmed bug;OS/Apple,https://api.github.com/repos/matplotlib/matplotlib/issues/1737,b'MacOSX backend unicode problems in python 3.3',"b'My matplotlib install on Python 3.3.0 seems to be cutting basically all strings in half in the MacOSX backend. This happens with both matplotlib 1.2.0 and the latest git; it doesn\'t happen on 2.7. I don\'t have a 3.2 install anymore, but I didn\'t see this problem with slightly earlier versions of matplotlib.\r\n\r\nFor example, if I simply run `plt.xlabel(\'xlabel\')`, only `xla` shows up in the xlabel position. This problem also applies to the ticks, so that labels that would normally say eg `0.2` say just `0.`. In general, it seems that the length of displayed strings is half the length of the passed string, rounded up. If I try to save the resulting figure through the backend, I get this exception:\r\n\r\n    Traceback (most recent call last):\r\n      File ""/usr/local/lib/python3.3/site-packages/matplotlib/backends/backend_macosx.py"", line 467, in save_figure\r\n        self.canvas.get_default_filename())\r\n    import matplotlib\r\n    ValueError: character U+55002f is not in range [U+0000; U+10ffff]\r\n\r\nThe Qt4Agg backend seems normal, and `matplotlib.test()` succeeds with only known failures and irrelevant warnings.\r\n\r\nI\'m on OSX 10.8.2 with the most recent Xcode command line tools (`clang --version` says `Apple LLVM version 4.2 (clang-425.0.24) (based on LLVM 3.2svn)`); dependencies are installed via homebrew.\r\n\r\nThe full log of `setup.py build` is [here](https://gist.github.com/274c73fe4504971d6dca), but only this quite suspcious-looking warning stands out:\r\n\r\n    src/_macosx.m:4979:51: warning: incompatible pointer types passing \'unichar *\' (aka \'unsigned short *\') to parameter of type\r\n          \'const Py_UNICODE *\' (aka \'const int *\') [-Wincompatible-pointer-types]\r\n            PyObject* string =  PyUnicode_FromUnicode(buffer, n);\r\n                                                      ^~~~~~\r\n    /usr/local/Cellar/python3/3.3.0/Frameworks/Python.framework/Versions/3.3/include/python3.3m/unicodeobject.h:702:23: note: passing argument to\r\n          parameter \'u\' here\r\n        const Py_UNICODE *u,        /* Unicode buffer */\r\n                          ^\r\n\r\nSince [the referenced line](https://github.com/matplotlib/matplotlib/blob/v1.2.0/src/_macosx.m#L4979) is in the function `choose_save_file`, it seems like that probably explains at least the problem with saving files, and `unichar` being an `unsigned short` vs `Py_UNICODE` being an `int` seems likely to explain the general problem (since a `short` is 2 bytes and an `int` is 4).\r\n\r\nThis presumably broke in 3.3 because of something related to [PEP 393](http://www.python.org/dev/peps/pep-0393/), which notes that ""The `Py_UNICODE` type is still supported but deprecated.""'"
1733,10569383,fkbreitl,tacaswell,2013-02-02 09:00:10,2014-01-23 12:57:53,2014-01-23 12:57:53,closed,,,2,confirmed bug,https://api.github.com/repos/matplotlib/matplotlib/issues/1733,"b""im.set_clip_path(rectangle) doesn't work""","b""I would like to clip a rectangular patch from an image, but my code below doesn't work. If I use a circle instead it works. It looks like a bug. Any help would be appreciated.\r\n(See also http://matplotlib.org/examples/api/clippath_demo.html and http://matplotlib.1069221.n5.nabble.com/Clipping-td19613.html).\r\n\r\n--\r\nimport matplotlib.pyplot as plt, numpy, matplotlib.patches as p\r\n\r\na=numpy.array([[1,2],[3,4]])\r\nim=plt.imshow(a)\r\nrect = p.Rectangle((0,0),1,1, transform=im.axes.transData)\r\ncircle = p.Circle((0,0),1, transform=im.axes.transData)\r\n#im.set_clip_path(circle)                                                      \r\nim.set_clip_path(rect)\r\nplt.show()\r\n"""
1679,10064568,mmokrejs,mdboom,2013-01-17 16:29:00,2013-03-01 17:13:10,2013-03-01 17:13:10,closed,,v1.2.x,9,confirmed bug;low hanging fruit,https://api.github.com/repos/matplotlib/matplotlib/issues/1679,b'matplotlib-1.2.0: regression in histogram with barstacked drawing?',"b'To: Matplotlib-users@lists.sourceforge.net\r\nMessage-ID: <50DF638E.80904@fold.natur.cuni.cz>\r\n\r\nHi,\r\n  I recently updated to matplotlib-1.2.0 from 1.1.1 and my figures have rotated\r\norder of color bars stacked upon each other. Here is a small testcase I sketched\r\nnow and two generated png files are attached, generated by the two different\r\nmatplotlib versions. The colornames are just bad in the legend, just to show that\r\nthe order of input data is same in both cases.\r\n\r\nI would be grateful for any comments on this.\r\nThank you,\r\nMartin\r\n\r\n#! /usr/bin/python\r\n\r\nimport pylab\r\n\r\nF = pylab.gcf()\r\n\r\nF.set_size_inches(11.2, 8.4)\r\n\r\n_e = [[100, 100, 100, 100, 200, 320, 450, 80, 20, 600, 310, 800], [20, 23, 50, 11, 100, 420], [120, 120, 120, 140, 140, 150, 180], [60, 60, 60, 60, 300, 300, 5, 5, 5, 5, 10, 300], [555, 555, 555, 30, 30, 30, 30, 30, 100, 100, 100, 100, 30, 30], [30, 30, 30, 30, 400, 400, 400, 400, 400, 400, 400, 400]]\r\n_ee = [(0.5759849696758961, 1.0, 0.0), (0.0, 1.0, 0.350624650815206), (0.0, 1.0, 0.6549834156005998), (0.0, 0.6569064625276622, 1.0), (0.28302699607823545, 0.0, 1.0), (0.6849123462299822, 0.0, 1.0)]\r\n_eee = [\'green\', \'orange\', \' yellow\', \'magenta\', \'black\']\r\n\r\npylab.hist(_e, bins=10, histtype=\'barstacked\', align=\'mid\', color=_ee, log=False, label=_eee)\r\n\r\npylab.legend(loc=\'upper right\', bbox_to_anchor = (1.0, 1.0), ncol=1)\r\n\r\nF.savefig(""hist_barstacked_bug.png"", dpi=100)'"
1673,10044811,tkanmae,dmcdougall,2013-01-17 03:05:32,2013-01-18 00:58:23,2013-01-18 00:58:23,closed,,1.2.x known bugs,4,confirmed bug,https://api.github.com/repos/matplotlib/matplotlib/issues/1673,b'Images saved as SVG get upside down when `svg.image_noscale` is True.',"b""I created a figure with an image using `imshow()` and saved it as SVG.  I realized that the saved image gets upside down when `svg.image_noscale` is True.\r\n\r\nI'm using matplotlib == 1.2.0 on Mac OS X.\r\n\r\nThe following code reproduces the issue.\r\n```python\r\nimport matplotlib.pyplot as plt\r\nimport numpy as np\r\n\r\n# Use default configuration.\r\nplt.matplotlib.rcdefaults()\r\n\r\n# Create a figure.\r\nfig = plt.figure()\r\nax = fig.add_subplot(111)\r\nX, Y = np.meshgrid(np.arange(-5, 5, 1), np.arange(-5, 5, 1))\r\nZ = np.sin(Y**2)\r\nax.imshow(Z, cmap='gray')\r\n\r\n# These are ok.\r\nfig.savefig('ok.png')\r\nfig.savefig('ok.svg')\r\n\r\n# Set `svg.image_noscale` to True.\r\nplt.rcParams['svg.image_noscale'] = True\r\n# Then, the image is upside down.\r\nfig.savefig('bad.svg')\r\n```\r\n\r\nThanks,"""
1591,9213134,pelson,mdboom,2012-12-12 11:29:13,2015-11-10 02:33:54,2013-03-22 16:08:20,closed,,v1.2.x,10,confirmed bug,https://api.github.com/repos/matplotlib/matplotlib/issues/1591,b'Image being snapped erroneously',"b'Since 1262326c00074fb497816242c9aa0e7787bd5cda implemented by @mdboom the following example results in a figure which has a 1 pixel border around left and bottom edges in the resultant image:\r\n\r\n```\r\nimport matplotlib.pyplot as plt\r\nimport matplotlib\r\n\r\nimport numpy\r\n\r\n\r\nif __name__ == \'__main__\':\r\n    print matplotlib.__version__\r\n\r\n    f = plt.figure(figsize=[1, 1])\r\n    ax = plt.axes([0, 0, 1, 1],\r\n                  frameon=False,\r\n                  )\r\n\r\n    data = numpy.tile(numpy.arange(12), 15).reshape(20, 9)\r\n    \r\n    im = ax.imshow(data, origin=\'upper\',\r\n                   extent=[-10, 10, -10, 10], interpolation=\'none\',\r\n                   cmap=\'gray\'\r\n                   )\r\n\r\n    x = y = 2\r\n    ax.set_xlim([-x, x])\r\n    ax.set_ylim([-y, y])\r\n        \r\n    ax.set_xticks([])\r\n    ax.set_yticks([])\r\n    \r\n    fname = \'test.png\'\r\n    plt.savefig(fname, facecolor=(0, 1, 0))\r\n    plt.close()\r\n    \r\n    im = plt.imread(fname)\r\n    r, g, b, a = sum(im[:, 0])\r\n    print \'Left edge: \', r, g, b, a\r\n    r, g, b, a = sum(im[:, -1])\r\n    \r\n    print \'Right edge:\' , r, g, b, a\r\n    assert g != 100, \'Expected a non-green edge - but sadly, it was.\'\r\n```\r\n![output](https://f.cloud.github.com/assets/810663/7907/0df5563e-444f-11e2-9128-5d91ace95c33.png)\r\n\r\nNotice the green 1px border on the bottom and right of the output.\r\n\r\nThe problem is limited to the Agg backend and the ""none"" image interpolation scheme.\r\n\r\nWith a bit of refinement, this example should be turned into a test once we have a fix for this.\r\n\r\n'"
1541,8774991,ruymanengithub,WeatherGod,2012-11-28 17:51:44,2014-07-11 21:58:14,2014-07-11 21:58:14,closed,WeatherGod,,9,confirmed bug;mplot3d,https://api.github.com/repos/matplotlib/matplotlib/issues/1541,b'Transparecy of figures in 3D plots (mplot3d)',"b""Hi,\n\nI'm trying to do a 3D plot with semi-transparent polyhedrons using mplot3d, but the setting of the alpha value has no effect. Here's the code I'm trying,\n\n\nimport mpl_toolkits.mplot3d as a3\nimport matplotlib.colors as colors\nimport pylab as pl\n\n\nax = a3.Axes3D(pl.figure())\n\ncolor = colors.rgb2hex(sp.rand(3))\n#color = (0.,1.,0.,0.2) # but this works!\n\nside1 = [[0.,0.,0.],[0.,0.,1.],[0.,1.,1.],[0.,1.,0.]]\ntri = a3.art3d.Poly3DCollection([side1])\ntri.set_facecolor(color)\ntri.set_edgecolor('k')\ntri.set_alpha(0.2)  # HAS NO EFFECT\n\nax.add_collection3d(tri)\n\nside2 = [[0.,0.,0.],[1.,0.,0.],[1.,1.,0.],[0.,1.,0.]]\ntri = a3.art3d.Poly3DCollection([side2])\ntri.set_facecolor(color)\ntri.set_edgecolor('k')\ntri.set_alpha(0.2)\n\nax.add_collection3d(tri)\n\npl.show()\n\n\nApparently, the tri.set_alpha sentences have no effect, and the pannels show solid. Changing color for an rgba tupla works, nonetheless (the commented line).\n\nCheers,\n\nRuyman"""
1539,8760997,pelson,mdboom,2012-11-28 11:03:36,2013-05-10 19:31:03,2013-05-10 19:31:03,closed,pelson,v1.3.x blocker,1,confirmed bug,https://api.github.com/repos/matplotlib/matplotlib/issues/1539,b'Pickling of log axes',"b""The following question was asked on stack overflow:\r\n\r\n-------\r\n\r\nPickling doesn't work when one uses logscale, eg:\r\n\r\n```\r\nimport matplotlib.pyplot as plt\r\nimport numpy as np\r\nimport pickle\r\nax = plt.subplot(111)\r\nx = np.linspace(0, 10)\r\ny = np.exp(x)\r\nplt.plot(x, y)\r\nax.set_yscale('log')\r\npickle.dump(ax, file('myplot.pickle', 'w'))\r\n```\r\n\r\nResults in the following:\r\n\r\n```\r\nPicklingError: Can't pickle <class 'matplotlib.scale.Log10Transform'>: attribute lookup matplotlib.scale.Log10Transform failed\r\n```\r\n\r\n------\r\n\r\nAnybody knows any solution/workaround to this?"""
1530,8631771,jfmoulin,efiring,2012-11-24 16:32:20,2013-05-24 19:28:41,2013-05-24 19:28:41,closed,,,14,confirmed bug,https://api.github.com/repos/matplotlib/matplotlib/issues/1530,b'saving a figure triggers (very) excessive IO activity ',"b'Saving a figure from the GUI under GTK triggers a lot of IO activity. Up to 60Mb/sec on my system.\nThe file /.local/share/recently-used.xbel gets written to each time the session history is scrolled through with cursor keys.\n\nI am running matplotlib 1.2.0 but this issue is, I believe, much older than that. \n\nI reported the issue to IPython (see https://github.com/ipython/ipython/issues/2608) first thinking this was a purely IPy problem but I could then reproduce the bug in a normal python session.\n\nAs suggested by rkern there, I posted a dump of strace and lsof at http://filebin.ca/NdspC6wfTV3\n\nAnother user also reported that saving from script triggers the same problem, but I could personnally not observe that with certainty.'"
1501,8389296,TPeter85,tacaswell,2012-11-15 15:05:55,2014-08-18 00:47:29,2014-08-18 00:47:29,closed,,,4,confirmed bug;mpl_toolkit,https://api.github.com/repos/matplotlib/matplotlib/issues/1501,b'Panning and zooming does not work on axes created with twinx (and twiny)',"b'See: http://matplotlib.org/examples/axes_grid/demo_parasite_axes2.html\n\nIf a plot is created like in the example above (using host_subplot for the host axes and twinx for the twin axes), panning or zooming does not work like in the case of the main axes. The twin axes seem to be fixed, i.e. their axis limits are not changed upon zooming or panning. This issue does not appear on the x-axis, only on y-axis (using twinx). This causes problems with interactive plots when zooming or panning is intented to show a part of the plotted lines. \n\nDuring vertical panning only the plots of the host axes are panned but the twin ones do not react. If panned in the horizontal direction everything works fine. \n\nIf zoomed in on an area where only the plots on the host axes should be seen both twin axes are visible. Actually the twin axes are zoomed in but only on the x-axis as if the zoom would be used on their x-axis only. \n\nThe problem seems to appear only with mpl_toolkits.axes_grid1; pyplot.figure and pylab.figure work fine. I have tried both matplotlib 1.1 and 1.2. Both versions have this problem. I am using Python 2.7.2 on a Windows 7 64 bit machine.'"
1499,8371936,phobson,tacaswell,2012-11-14 22:54:22,2014-02-25 02:13:38,2014-02-25 02:13:38,closed,,,3,confirmed bug,https://api.github.com/repos/matplotlib/matplotlib/issues/1499,b'twinx() on an inset axes wrongly acts on the main axes',"b'Seen here:\r\nhttp://stackoverflow.com/questions/13385924/adding-a-second-y-axis-to-an-inset-zoom-axes\r\n\r\nOn version 1.2.0, this is all fine and dandy:\r\n\r\n    import numpy as np\r\n    import matplotlib.pyplot as plt\r\n    from mpl_toolkits.axes_grid1.inset_locator import zoomed_inset_axes\r\n    from mpl_toolkits.axes_grid1.inset_locator import mark_inset\r\n\r\n    # Initializing the curve\r\n    fig = plt.figure()\r\n    main_ax1 = fig.add_subplot(111)\r\n    main_ax2 = main_ax1.twinx()\r\n\r\n    # quantities to plot\r\n    Tension = np.linspace(0,0.08,100)\r\n    Weight = 0.5 * Tension\r\n    Mass = Weight/9.81\r\n\r\n    # Plotting the curve\r\n    main_ax1.plot(Tension, Weight, \'r\', label=\'Fitted line\',lw=2)\r\n    main_ax2.plot(Tension, Mass)\r\n\r\n    # Cosmetic on the Figure\r\n    main_ax1.set_xlabel(""Tension U [$V$]"")\r\n    main_ax1.set_ylabel(""Weight F [$N$]"")\r\n    main_ax2.set_ylabel(""Mass M [$kg$]"")\r\n    main_ax2.set_ylim(main_ax1.axis()[-2]/9.81, main_ax1.axis()[-1]/9.81)\r\n    main_ax1.grid(False)\r\n\r\n    # Zoom on the first measurement\r\n    zoom_ax1 = zoomed_inset_axes(main_ax1, zoom = 7.5, bbox_to_anchor=(0.95,0.5), bbox_transform=main_ax1.transAxes)\r\n    mark_inset(main_ax1, zoom_ax1, loc1=2, loc2=4, fc=""none"", ec=""0.5"")\r\n    zoom_ax1.plot(Tension[:4], Weight[:4], \'r\', lw=2)\r\n    zoom_ax1.set_xticks(zoom_ax1.xaxis.get_majorticklocs()[::2])\r\n    zoom_ax1.set_yticks(zoom_ax1.yaxis.get_majorticklocs()[::2])\r\n\r\nThe unexpected behavior happens here:\r\n\r\n    # this happens to `main_ax2` istead of `zoom_ax1`\r\n    zoom_ax2 = zoom_ax1.axes.twinx()\r\n    zoom_ax2.plot(Tension[:4], Mass[:4],alpha=0)\r\n    zoom_ax2.set_ylim(zoom_ax1.axis()[-2]/9.81,zoom_ax1.axis()[-1]/9.81)\r\n    zoom_ax2.set_ylabel(\'TESTING\')\r\n\r\n    plt.show()'"
1495,8337175,akhmerov,dmcdougall,2012-11-13 21:47:56,2012-11-14 00:07:14,2012-11-14 00:07:14,closed,,,7,confirmed bug;Documentation;low hanging fruit,https://api.github.com/repos/matplotlib/matplotlib/issues/1495,"b'scatter docstring, minor'","b'pyplot.scatter() and axes.scatter() docstrings say that a Collection instance is returned, while it is a PathCollection instead.'"
1490,8330313,akhmerov,efiring,2012-11-13 18:08:11,2013-02-17 20:58:59,2013-02-17 20:58:59,closed,,,3,confirmed bug,https://api.github.com/repos/matplotlib/matplotlib/issues/1490,b'empty scatter messes up the limits',"b""Tested with 1.1.1 (didn't manage 1.2.0 to show anything yet).\r\n\r\nTo reproduce:\r\n\r\nfrom matplotlib import pyplot as plt\r\nplt.scatter([0,1],[0,1])\r\nplt.scatter([], [])  # The lower limit shifts appreciably, compared to not executing this line.\r\nplt.show()\r\n"""
1465,8210806,NelleV,efiring,2012-11-08 16:51:45,2012-12-07 04:14:07,2012-12-07 04:14:07,closed,,v1.2.x,3,confirmed bug,https://api.github.com/repos/matplotlib/matplotlib/issues/1465,b'Undefined elements in axes module',"b""Dixit pyflakes, there are several undefined elements in the axes module:\r\n\r\n- The method ``Axes.__pick`` (line 3240) calls ``test``, which isn't defined\r\n- The method ``Axes.dist`` (line 3221) calls ``Patch`` and ``Text`` which haven't been imported\r\n\r\nThanks,\r\nN"""
1444,8029739,mdboom,mdboom,2012-11-01 13:06:09,2014-07-01 15:58:31,2012-11-01 17:13:41,closed,mdboom,v1.2.x,3,confirmed bug,https://api.github.com/repos/matplotlib/matplotlib/issues/1444,b'Colorbar edges are different in PDF backend',"b""In a message on matplotlib-users from Andrew Dawson:\r\n\r\nHi all,\r\n\r\nI just noticed that colorbar edges are drawn in white when output in PDF and black when output in PNG. A small test script is attached along with the output to show the difference.\r\n\r\nI'd be interested in knowing if others can reproduce this? I'm using mpl-1.3.x (updated 5 minutes ago) on 64-bit Ubuntu 12.04.\r\n\r\nCheers,\r\nAndrew\r\n\r\n```\r\nimport matplotlib.pyplot as plt\r\nimport numpy as np\r\n\r\n# dummy data\r\nx = y = np.linspace(-np.pi, np.pi, 50)\r\nX, Y = np.meshgrid(x, y)\r\nZ = np.sin(X) * np.cos(2.*Y)\r\n\r\n# draw a filled contour plot and add a colorbar with drawedges turned on\r\ncontours = plt.contourf(x, y, Z)\r\ncb = plt.colorbar(orientation='horizontal', drawedges=True)\r\n\r\n# turn off tick marks so the edges can be seen\r\nfor tick in cb.ax.get_xticklines() + cb.ax.get_yticklines():\r\n    tick.set_visible(False)\r\n\r\n# save as a PDF and a PNG\r\nplt.savefig('test.pdf')\r\nplt.savefig('test.png')\r\n```"""
1424,7764634,jornbr,pelson,2012-10-22 12:30:09,2012-10-23 14:02:14,2012-10-23 14:02:14,closed,dmcdougall,v1.2.x,3,confirmed bug,https://api.github.com/repos/matplotlib/matplotlib/issues/1424,b'pcolor fails if edgecolors is not a string',"b'In axes.py, pcolor, line 7350, variable ""ec"" (edgecolors) is treated as a string, since ec.lower() is called and compared to \'none\'. However, the documentation specifies that edgecolors may be also be a color or color sequence (e.g., a tuple with RGB values). In that case, the call to lower() triggers an AttributeError. Moreover, if the edgecolor/edgecolors is not provided, while ""shading"" is ""faceted"", edgecolors defaults to \'k\', Due to the trailing comma this is a tuple, not a string, which again causes an AttributeError to be raised later on.\r\n'"
1371,7546300,andreas-h,tacaswell,2012-10-12 15:45:08,2014-01-16 22:39:32,2014-01-16 22:39:32,closed,,,2,confirmed bug,https://api.github.com/repos/matplotlib/matplotlib/issues/1371,b'vertical alignment of yticklabels fails on `0`',"b""The following code produces a plot where the yticklabels are neatly aligned vertically on the right - except for the one at `y=0`, which is a bit further to the right. I suppose this is a bug?\r\n\r\n    from numpy import random, linspace, arange\r\n    from numpy.ma import masked_invalid\r\n    import matplotlib as mpl\r\n    import matplotlib.pyplot as plt\r\n    \r\n    data = random.randn(12,72)\r\n    \r\n    nxbin, nybin = data.shape\r\n    xbin = linspace(0, 12, nxbin + 1)\r\n    ybin = linspace(-90, 90, nybin + 1)\r\n    pdata = masked_invalid(data)\r\n    \r\n    cmap = mpl.cm.seismic\r\n    cmap.set_bad('#cccccc', 1.)\r\n    \r\n    fig = plt.figure(figsize=(12,2))\r\n    ax = fig.add_subplot(111)\r\n    \r\n    pl = ax.pcolormesh(xbin, ybin, pdata.T,\r\n            cmap=cmap, edgecolors='None',\r\n            vmin=-7,vmax=7,\r\n            )\r\n    ax.axis([0., 12., ybin.min(), ybin.max()])\r\n    ax.set_xticks(xbin)\r\n    ax.set_xticklabels([])\r\n    ax.set_xticks(xbin[1:] - 0.5, minor=True)\r\n    ax.set_xticklabels(['J','F','M','A','M','J','J','A','S','O','N','D'],\r\n            size='medium', minor=True)\r\n    ax.set_xlim([0.,12.])\r\n    ax.set_yticks(linspace(-90., 90., 13))\r\n    ax.set_yticklabels(arange(-90,91,15), size='medium', fontname='Arial')\r\n    for line in ax.xaxis.get_minorticklines():\r\n        line.set_markersize(0)\r\n"""
1343,7427994,dmcdougall,efiring,2012-10-08 18:47:00,2012-10-14 05:09:56,2012-10-14 05:09:56,closed,,v1.2.x,3,confirmed bug,https://api.github.com/repos/matplotlib/matplotlib/issues/1343,b'Date axis formatter problem',"b""Problem: The autodatelocator and autodateformatter don't seem to work properly. One, the formatter doesn't seem to work immediately after being applied to an axis. A manual call to the locator seems necessary. Two, the autodatelocator doesn't seem to be able to handle view intervals less than 1 second, i.e., the tick labels don't show digits beyond second. You can see this by zooming the example figure from the code below to a level shorter than one second.\r\n\r\n1. Operating system: OS X 10.8.2\r\n2. matplotlib version: 1.2.0rc2\r\n3. I installed matplotlib via:\r\n`pip install git+https://github.com/matplotlib/matplotlib.git#egg=matplotlib-dev`\r\n4. Backend: TkAgg, but I don't think the problem depends on the backend.\r\n5. Code:\r\n\r\n```python\r\n#--------------------------------- code -----------------------------------------------------\r\n# Running in ipython --pylab mode.\r\nfig = figure()\r\ntsta = num2epoch(date2num(datetime.datetime.now()))\r\ntarr = tsta + arange(0, 60*30., 0.01) # half hour, dt = 0.01 sec\r\nx = np.array(num2date(epoch2num(tarr)))\r\nnt = len(tarr)\r\ny = randn(nt)\r\n\r\nax = fig.add_subplot(111)\r\nax.plot(x, y)\r\nfig.canvas.draw()  # Show an overall view of the data\r\n\r\nlocator = mpl.dates.AutoDateLocator()\r\nformatter = mpl.dates.AutoDateFormatter(locator)\r\n\r\nformatter.scaled = {\r\n    365.0 : '%Y',\r\n    30. : '%b %Y',\r\n    1.0 : '%b %d',\r\n    1./24. : '%H:%M',\r\n    1./24./60. : '%M:%S',\r\n    1./24./60./60. : '%S',\r\n}\r\nax.get_xaxis().set_major_formatter(formatter)  # Won't work immediately.\r\nlocator.set_axis(ax.xaxis) # Have to manually make this call and the one below.\r\nlocator.refresh()               # Another manual call.\r\nfig.canvas.draw()\r\n```"""
1325,7334977,michaelaye,tacaswell,2012-10-03 21:17:06,2015-07-17 03:50:50,2015-07-17 03:50:44,closed,,v1.5.0,9,confirmed bug;needs_patch,https://api.github.com/repos/matplotlib/matplotlib/issues/1325,b'Auto-scaling of extent not working for subplots when using sharex and sharey',"b'Using MPL 1.1.0 from the 32-bit EPD 7.3-2 on a Macbook Pro Retina.\r\n\r\nThis error only shows when using subplots. When creating your own sublots via add_subplot it does not seem to occur.\r\n\r\n```python\r\nfrom matplotlib.pyplot import show, subplots\r\nfrom numpy import arange, array\r\n\r\narr = arange(10000).reshape(100,100)\r\nl = [arr,arr,arr,arr]\r\nnarr = array(l)\r\n\r\nfig, axes = subplots(2,2,sharex=True,sharey=True)\r\n\r\nfor ax,im in zip(axes.flatten(),narr):\r\n    ax.imshow(im)\r\n\r\nshow()\r\n```\r\n\r\n### Expected vs Seen:\r\nOne can see that all the 4 axes show the image array with an extent of [-10,110, 0, 100] here instead of the expected intent of [0,100, 0, 100].\r\n'"
1318,7240262,efiring,efiring,2012-09-29 19:52:57,2015-07-18 18:56:29,2015-07-18 18:56:28,closed,,v1.5.0,14,confirmed bug;GUI/Qt;not a blocker;OS/Apple,https://api.github.com/repos/matplotlib/matplotlib/issues/1318,b'qt4backend zoom-to-rect box is drawn incorrectly on OSX',"b'Only on OSX:\r\n\r\n```python\r\nimport matplotlib\r\nmatplotlib.use(""qt4agg"")\r\nimport matplotlib.pyplot as plt\r\nplt.plot([1,2,3])\r\nplt.show()\r\n```\r\nNow click zoom-to-rect; instead of a solid rectangle outline, I get a dotted L-shape.\r\n\r\nThis is with mpl v1.2.x, 7f5b00526b92, pyqt 4.9.4 from homebrew, OS X 10.8. '"
1316,7185670,megies,dmcdougall,2012-09-27 14:12:13,2015-03-03 18:44:49,2012-10-01 22:11:41,closed,,,15,confirmed bug,https://api.github.com/repos/matplotlib/matplotlib/issues/1316,b'very high negative zorder breaks vector graphic rendering',"b'I have stumbled over a problem in vector graphic output with the pdf backend in combination with very high negative zorders (high positive values seem to be ok). Using the following example you see that for very high, negative zorder values the object gets visualized as bitmap.\nI have verified this on matplotlib compiled from current master (Debian Squeeze, Python 2.6.6, with additional numpy 1.6.2).\n```python\nimport matplotlib\nmatplotlib.use(""pdf"")\nimport matplotlib.pyplot as plt\nplt.plot([0, 1], [0, 1], zorder=-10000000)\nplt.savefig(""/tmp/zorder_bad.pdf"")\nplt.figure()\nplt.plot([0, 1], [0, 1], zorder=-100)\nplt.savefig(""/tmp/zorder_ok.pdf"")\nplt.figure()\nplt.plot([0, 1], [0, 1], zorder=1000000000000000)\nplt.savefig(""/tmp/zorder_ok2.pdf"")\n```\nWhile this is obviously easy to circumvent (use reasonable zorder values ;)), I nevertheless think this should be fixed.'"
