issue,id,reporter,closed_by,created_at,updated_at,closed_at,state,assignee,milestone,comments,label_name,url,title,body
3196,37304142,astrofrog,mdboom,2014-07-07 19:54:23,2014-12-03 17:35:38,2014-12-03 16:39:34,closed,mdboom,v1.4.x,18,confirmed bug,https://api.github.com/repos/matplotlib/matplotlib/issues/3196,b'Issue with iterability of axes arguments [backport to 1.4.x]',"b""I have been trying to use the ``_as_mpl_axes`` method to create a custom projection. I am returning an Axes subclass and a dictionary of arguments to pass to the class. One of the arguments is an item of type ``astropy.wcs.WCS``. In ``figure.py``, the following code:\r\n\r\n```\r\n        def fixitems(items):\r\n            #items may have arrays and lists in them, so convert them\r\n            # to tuples for the key\r\n            ret = []\r\n            for k, v in items:\r\n                if iterable(v):\r\n                    v = tuple(v)\r\n                ret.append((k, v))\r\n            return tuple(ret)\r\n```\r\n\r\nresults in an error, specifically when doing ``tuple(v)``. The issue is that ``iterable(wcs)`` returns ``True`` but ``tuple(wcs)`` crashes. As a general issue, ``iter(v)`` working does not guarantee that ``tuple(v)`` will work. One solution is to simply do:\r\n\r\n```\r\nif iterable(v):\r\n    try:\r\n        v = tuple(v)\r\n    except:\r\n        pass\r\n```\r\n\r\nI'm not sure if there is a better way to deal with this kind of issue. Just for the record, ``tuple(wcs)`` gives:\r\n\r\n```\r\nValueError: Cannot downsample a WCS with indexing.  Use wcs.sub or wcs.dropaxis if you want to remove axes.\r\n```\r\n\r\nTo some extent, the issue here is that while ``WCS`` has a ``__getitem__`` method, it is not strictly iterable. So maybe the issue is actually that ``iterable`` should not rely just on ``iter``. Maybe the ``iterable`` function:\r\n\r\n```\r\n\r\ndef iterable(obj):\r\n    'return true if *obj* is iterable'\r\n    try:\r\n        iter(obj)\r\n    except TypeError:\r\n        return False\r\n    return True\r\n```\r\n\r\nin ``cbook.py`` should be using:\r\n\r\n```\r\nnext(iter(wcs))\r\n```\r\n\r\n? (which does raise an error in my case)\r\n\r\ncc @mdboom, since it involves the WCS class.\r\n"""
3166,36750843,twiecki,dopplershift,2014-06-29 17:34:54,2014-07-11 16:28:39,2014-07-11 16:28:39,closed,,v1.4.0,1,confirmed bug,https://api.github.com/repos/matplotlib/matplotlib/issues/3166,"b'subplot(x, x, 0) should raise Exception'","b""I'm sure I'm not the only one who used this idiom:\r\n```python\r\nfor i in range(4):\r\n   plt.subplot(2, 2, i)\r\n```\r\n\r\nAnd got confused that the subplots show up in the wrong order. Understandbly, subplot uses 1-based indexing. But what about throwing an exception if 0 is passed, that would save a lot of wasted hours tracking down this odd behavior."""
3117,35101708,jorgesca,pelson,2014-06-05 21:55:10,2014-06-10 12:44:44,2014-06-10 12:44:44,closed,,v1.4.0,4,confirmed bug;Release critical,https://api.github.com/repos/matplotlib/matplotlib/issues/3117,b'Qt4 backend using unichr() in python3',"b""I get a NameError exception (see backtrace below) when trying to use key\r\nevents in matplotlib (master branch rev:\r\ne322d5f5bb024bbec44d3ba76da1bc16bf52af9c), python 3.4.1, and pyqt 4.10.\r\nThis has been posted to the matplotlib-users ml: http://thread.gmane.org/gmane.comp.python.matplotlib.general/34364\r\n\r\n```python\r\nNameError                                 Traceback (most recent call last)\r\n/home/jscandal/sw/matplotlib/matplotlib/lib/matplotlib/backends/backend_qt4.py\r\nin\r\nkeyReleaseEvent(self=<matplotlib.backends.backend_qt4agg.FigureCanvasQTAgg\r\nobject>, event=<PyQt4.QtGui.QKeyEvent object>)\r\n    308 \r\n    309     def keyReleaseEvent(self, event):\r\n--> 310         key = self._get_key(event)\r\n        key = undefined\r\n        self._get_key = <bound method FigureCanvasQTAgg._get_key of\r\n<matplotlib.backends.backend_qt4agg.FigureCanvasQTAgg object at 0x7f0393412948>>\r\n        event = <PyQt4.QtGui.QKeyEvent object at 0x7f0393507a68>\r\n    311         if key is None:\r\n    312             return\r\n\r\n/home/jscandal/sw/matplotlib/matplotlib/lib/matplotlib/backends/backend_qt4.py\r\nin _get_key(self=<matplotlib.backends.backend_qt4agg.FigureCanvasQTAgg\r\nobject>, event=<PyQt4.QtGui.QKeyEvent object>)\r\n    363                 return None\r\n    364 \r\n--> 365             key = unichr(event_key)\r\n        key = undefined\r\n        global unichr = undefined\r\n        global event_key = undefined\r\n    366             # qt delivers capitalized letters.  fix capitalization\r\n    367             # note that capslock is ignored\r\n\r\nNameError: name 'unichr' is not defined\r\n```"""
3095,34640900,dkillick,tacaswell,2014-05-30 12:27:49,2015-01-31 18:15:46,2015-01-31 18:15:45,closed,pelson,v1.4.3,11,confirmed bug;Release critical,https://api.github.com/repos/matplotlib/matplotlib/issues/3095,b'Memory issue when plotting large arrays with pcolormesh',"b'Plotting large-ish arrays using pcolormesh with current (e2c5918) matplotlib master looks like it might have a memory leak. Running the following code on matplotlib v1.3.1 produces a `QuadMesh` in approximately a second. However running the same code on matplotlib master floods the memory until either the pcolormesh call is aborted or it runs out of memory.\r\n\r\n```python\r\nimport matplotlib.pyplot as plt\r\nimport numpy as np\r\n\r\ndata = np.random.rand(3000*3000).reshape(3000, 3000)\r\nplt.pcolormesh(data)\r\nplt.show()\r\n```'"
3091,34416884,bennettbrowniowa,tacaswell,2014-05-27 21:54:51,2014-06-01 13:18:39,2014-06-01 13:18:39,closed,,v1.4.0,9,confirmed bug,https://api.github.com/repos/matplotlib/matplotlib/issues/3091,"b""set_xlim() crashes kernel if interpolation='none'""","b'Using matplotlib 1.3.1-3, the following code causes my Python kernel to crash. \r\n\r\nimg = plt.imread(""cat.png"")\r\nfig, ax = plt.subplots(1, 3)\r\nax[0].imshow(img, interpolation=\'none\')\r\nax[0].set_xlim(135,165) # larger than image\r\nfig.show()'"
3057,33246844,Phlya,tacaswell,2014-05-10 19:40:21,2016-02-18 02:39:53,2016-02-18 02:36:03,closed,,2.0 (style change major release),15,backend/AGG;confirmed bug,https://api.github.com/repos/matplotlib/matplotlib/issues/3057,b'DPI-connected bug of imshow when using multiple masked arrays',"b""Initial discussion started here: http://stackoverflow.com/questions/23490289/matplotlib-shows-different-figure-than-saves-from-the-show-window\r\n\r\nEssentially I need to combine a few arrays to make a whole image I want to produce using imshow. So that the arrays do not overlay each other I use masking (as in the example at StackOverflow) or I set some data to `None`, so that it is not plotted; I do this:\r\n\r\n    cmap = matplotlib.cm.get_cmap()\r\n    cmap.set_bad('w', 0.0)\r\n\r\nSee the whole working example:\r\n\r\n    import matplotlib\r\n    import matplotlib.pyplot as plt\r\n    import numpy as np\r\n    \r\n    data = np.random.random((3000, 3000))\r\n    data[np.tril_indices_from(data, 1)] = None\r\n    data2 = np.random.random((3000, 3000))\r\n    data2[np.triu_indices_from(data2, -1)] = None\r\n    \r\n    cmap = matplotlib.cm.get_cmap()\r\n    cmap.set_bad('w', 0.0)\r\n    \r\n    plt.imshow(data, interpolation='none', cmap=cmap)\r\n    plt.imshow(data2, interpolation='none', cmap=cmap)\r\n    plt.locator_params(nbins=60)\r\n    plt.show()\r\n\r\nSo the thing is, if I look at such image in an interactive window everything looks perfect (e.g. I zoomed into top-left corner, so that the pixels are visible:\r\n![show_zoom_save](https://cloud.githubusercontent.com/assets/2895034/2936883/ad1ebeb2-d878-11e3-8ff0-2a020eceb90e.png)\r\n\r\nIf I save the whole image to a file from the Save-dialog of the window, the image gets screwed, so that the pixels are much bigger, than they should (it is a printscreen of Inkscape with opened SVG-file, where I zoomed to approximately the same coordinates):\r\n![_046](https://cloud.githubusercontent.com/assets/2895034/2936885/e8004eba-d878-11e3-94c4-2fc7b082979d.png)\r\nSame goes to direct saving the image to disk (SVG):\r\n![_047](https://cloud.githubusercontent.com/assets/2895034/2936891/1ccb50d6-d879-11e3-858c-27cd4d543f87.png)\r\nIf I use only data, but not data2, the image looks good:\r\n![_048](https://cloud.githubusercontent.com/assets/2895034/2936895/583593d4-d879-11e3-91a5-64dc8b24d98a.png)\r\nIf I save both of them, but change the dpi (e.g. to 900), the image changes and the so-to-say resolution gets better, but the image gets really messy:\r\n![_049](https://cloud.githubusercontent.com/assets/2895034/2936901/a86e285c-d879-11e3-91b5-db328f2eebf3.png)\r\nYou can probably see, that some pixels are distorted. If not, here is a closer zoom into this image:\r\n![_050](https://cloud.githubusercontent.com/assets/2895034/2936908/f028d278-d879-11e3-8f3d-833caa72c889.png)\r\nAt the same time you can see, that the white diagonal no more ends and starts in the very corner of the image.\r\n\r\nAs far as I understand, this is a bug, or at least undocumented behaviour, because I haven't found any mentioning of possibility of such weird effects anywhere. Using such plots (though not randomly generated) is crucial to my research, I would really like this fixed or being pointed out to a solution for this problem.\r\n\r\nPlease let me know, if you can reproduce such effects and if you need any further information from me.\r\n\r\nI use matplotlib 1.3.1 on Ubuntu 14.04 with Python 2.7.6 and Spyder 2.2.5."""
3028,32571253,huard,tacaswell,2014-04-30 20:40:55,2014-05-03 23:41:29,2014-05-03 23:41:29,closed,,v1.4.0,1,confirmed bug,https://api.github.com/repos/matplotlib/matplotlib/issues/3028,b'Import error QT4 backend with python3.2.3',"b'On current master, importing matplotlib using QT4Agg backend yields the following error:\r\n```python\r\nFile ""/lib/python3.2/site-packages/matplotlib-1.4.x-py3.2-linux-x86_64.egg/matplotlib/backends/backend_qt4.py"", line 374\r\n    return u\'+\'.join(mods + [key])\r\n              ^\r\nSyntaxError: invalid syntax\r\n```\r\n'"
3026,32555173,palob,tacaswell,2014-04-30 17:15:22,2014-05-03 14:49:05,2014-05-03 14:49:05,closed,,v1.4.0,4,confirmed bug,https://api.github.com/repos/matplotlib/matplotlib/issues/3026,b'Bug in matplotlib.mlab.levypdf',"b'**matplotlib.mlab.levypdf** raises ~~ValueError~~  `TypeError` due to wrong **numpy.arange** input (lines 1571,1573 and 1574 of mlab.py):\r\n\r\ndtype as third input parameter of numpy.arange must be preceded by `dtype=` .\r\n\r\n'"
2980,31525520,breedlun,pelson,2014-04-15 04:26:45,2014-11-30 15:13:13,2014-11-30 15:13:12,closed,,v1.4.x,3,confirmed bug;hackathon,https://api.github.com/repos/matplotlib/matplotlib/issues/2980,b'get_window_extent method for an image object gives all zeros',"b""I am finding that the get_window_extent method for an image object gives all zeros.\r\n\r\nFor example\r\n\r\n    import numpy as np\r\n    import matplotlib.pyplot as plt\r\n\r\n    im = np.array([[0.25, 0.75, 1.0, 0.75], [0.1, 0.65, 0.5, 0.4], \\\r\n        [0.6, 0.3, 0.0, 0.2], [0.7, 0.9, 0.4, 0.6]])\r\n    fig = plt.figure()\r\n    ax = plt.subplot()\r\n    ax.set_xlim(0,1)\r\n    ax.set_ylim(0,1)\r\n    im_obj = ax.imshow(im, extent = [0.25, 0.75, 0.25, 0.75], interpolation = 'nearest')\r\n    \r\nproduces the following plot\r\n\r\n![image](http://s9.postimg.org/dobdiczfj/wtf.png)\r\n\r\nNow I want to get the image size in display coordinates, so I do the following:\r\n\r\n    fig.canvas.draw()\r\n    renderer = fig.canvas.renderer\r\n    im_bbox = im_obj.get_window_extent(renderer)\r\nThe trouble is `print im_bbox` produces `Bbox('array([[ 0.,  0.],\\n       [ 0.,  0.]])')`. The method `.get_window_extent(renderer)` works fine with text, lines, and patches, so I was a bit surprised to see it does not work with images.\r\n\r\nIn case it matters, I am using Matplotlib 1.3.0 with the TkAgg backend."""
2964,31186623,wuxb45,tacaswell,2014-04-09 19:21:25,2014-04-11 00:56:32,2014-04-11 00:55:19,closed,,v1.4.0,1,confirmed bug;low hanging fruit;needs_patch,https://api.github.com/repos/matplotlib/matplotlib/issues/2964,b'line style rendering error',"b'![line-style](https://cloud.githubusercontent.com/assets/564235/2660110/c19b85ac-c01b-11e3-87d4-097eea524b42.png)\r\n\r\n\r\nThe ""markertri_up marker"" and ""markertri_up marker"" randers to each other.\r\n\r\n```python\r\n#!/usr/bin/python\r\n\r\nimport matplotlib.pyplot as plt \r\n\r\ndef x_line_style():\r\n  styles = {    \'-1\' :\'markertri_down marker\'       , \\\r\n    \'-2\' :\'markertri_up marker\'         , \\\r\n    \'-3\' :\'markertri_left marker\'       , \\\r\n    \'-4\' :\'markertri_right marker\'     }\r\n  fig1, ax1 = plt.subplots(1, 1, figsize=(5,5))\r\n  i = 1 \r\n  ax1.set_xlim(0, 10) \r\n  ax1.set_ylim(0, 5)\r\n  for (x,y) in styles.items():\r\n    ax1.plot(range(0,10), [i for j in range(0,10)], (x), label=y, color=\'r\')\r\n    i = i + 1 \r\n  ax1.legend(loc=7)\r\n  fig1.savefig(\'line-style.png\', format=\'png\')\r\n  plt.close(fig1)\r\n\r\nx_line_style()\r\n```'"
2963,31124349,ilogue,tacaswell,2014-04-09 01:58:49,2014-08-18 16:38:31,2014-06-04 17:41:29,closed,,v1.4.0,13,confirmed bug,https://api.github.com/repos/matplotlib/matplotlib/issues/2963,b'Segmentation Fault on adding BBoxImage to matshow',"b""I am trying to add an image to axes with matshow() but getting `Segmentation fault (core dumped)` (no stacktrace). When replacing the matshow with a simple e.g. plot(range(10)), it works as expected.\r\n\r\n```\r\nfrom matplotlib.image import BboxImage,imread\r\nfrom matplotlib.transforms import Bbox\r\nimport matplotlib.pyplot as plt\r\nimport numpy as np\r\n\r\nfig = plt.figure()\r\nax = fig.add_subplot(111)\r\n#ax.plot(range(10))                           # this works\r\nax.matshow(np.array([[1,2],[3,4]]))    #this doesn't\r\nlowerCorner = ax.transData.transform((.8,-.8))\r\nupperCorner = ax.transData.transform((1.2,-.4))\r\nbbox_image = BboxImage(Bbox([lowerCorner[0],\r\n                             lowerCorner[1],\r\n                             upperCorner[0],\r\n                             upperCorner[1],\r\n                             ]),\r\n                       norm = None, origin=None, clip_on=False)\r\npath = '/usr/share/pixmaps/firefox.png' # example image available on ubuntu\r\nimage = imread(path)\r\nbbox_image.set_data(image)\r\nax.add_artist(bbox_image)\r\nplt.show()\r\n```\r\n\r\nThanks for matplotlib!\r\nJasper"""
2941,30453139,mscross,tacaswell,2014-03-29 21:27:02,2014-06-02 12:15:33,2014-06-02 12:15:33,closed,,v1.4.x,6,confirmed bug;needs_patch,https://api.github.com/repos/matplotlib/matplotlib/issues/2941,b'Order of ax.spines[].set_position() and ax.yaxis.set_major_formatter() produces different results',"b'In the first example, `ax.spines[\'right\'].set_position()` is called first, and the negative signs on the right y-axis are smaller hyphen-minus symbols because they were passed through `ax.yaxis.set_major_formatter()`.   in the second example, the order is reversed, and the formatter is not applied or is reset (i.e., the negative signs are the larger unicode character `\\u2212`).\r\n\r\nI was under the impression that matplotlib settings were order-agnostic before `plt.show()`- is this a bug?\r\n\r\n``` python\r\nimport numpy as np\r\nimport matplotlib.pyplot as plt\r\nfrom matplotlib.ticker import FormatStrFormatter, MultipleLocator\r\n\r\nfig, ax1 = plt.subplots()\r\nt = np.arange(0.01, 10.0, 0.01)\r\ns1 = np.exp(t)\r\nax1.plot(t, s1, \'b-\')\r\nax1.set_xlabel(\'time (s)\')\r\n# Make the y-axis label and tick labels match the line color.\r\nax1.set_ylabel(\'exp\', color=\'b\')\r\nfor tl in ax1.get_yticklabels():\r\n    tl.set_color(\'b\')\r\n\r\nymajorFormatter = FormatStrFormatter(""%.1f"")\r\n\r\nax2 = ax1.twinx()\r\ns2 = np.sin(2*np.pi*t)\r\nax2.plot(t, s2, \'r.\')\r\nax2.set_ylabel(\'sin\', color=\'r\')\r\nfor tl in ax2.get_yticklabels():\r\n    tl.set_color(\'r\')\r\n\r\n# ax2.yaxis.set_major_formatter(ymajorFormatter)\r\nax2.spines[\'right\'].set_position((\'axes\', 1.1))\r\nax2.yaxis.set_major_formatter(ymajorFormatter)\r\nplt.show()\r\n```\r\n![spine_thenformat](https://cloud.githubusercontent.com/assets/6813152/2559685/dade2ec2-b786-11e3-93f6-10031b059684.png)\r\n\r\n``` python\r\nfig, ax1 = plt.subplots()\r\nt = np.arange(0.01, 10.0, 0.01)\r\ns1 = np.exp(t)\r\nax1.plot(t, s1, \'b-\')\r\nax1.set_xlabel(\'time (s)\')\r\n# Make the y-axis label and tick labels match the line color.\r\nax1.set_ylabel(\'exp\', color=\'b\')\r\nfor tl in ax1.get_yticklabels():\r\n    tl.set_color(\'b\')\r\n\r\nymajorFormatter = FormatStrFormatter(""%.1f"")\r\n\r\nax2 = ax1.twinx()\r\ns2 = np.sin(2*np.pi*t)\r\nax2.plot(t, s2, \'r.\')\r\nax2.set_ylabel(\'sin\', color=\'r\')\r\nfor tl in ax2.get_yticklabels():\r\n    tl.set_color(\'r\')\r\n\r\nax2.yaxis.set_major_formatter(ymajorFormatter)\r\nax2.spines[\'right\'].set_position((\'axes\', 1.1))\r\n# ax2.yaxis.set_major_formatter(ymajorFormatter)\r\nplt.show()\r\n```\r\n![format_thenspine](https://cloud.githubusercontent.com/assets/6813152/2559697/85913aee-b787-11e3-86fe-8ee94928a1f5.png)'"
2842,28275392,Arfrever,efiring,2014-02-25 19:28:07,2016-05-22 04:55:58,2016-05-22 04:55:58,closed,,2.1 (next point release),2,confirmed bug,https://api.github.com/repos/matplotlib/matplotlib/issues/2842,b'matplotlib.tests.test_basic.test_override_builtins() fails with Python >=3.4',"b'`matplotlib.tests.test_basic.test_override_builtins()` fails with Python >=3.4 due to `__spec__`.\r\nhttp://docs.python.org/3.4/reference/import.html#__spec__\r\n\r\nI use Matplotlib 1.3.1.\r\n\r\n```\r\n======================================================================\r\nFAIL: matplotlib.tests.test_basic.test_override_builtins\r\n----------------------------------------------------------------------\r\nTraceback (most recent call last):\r\n  File ""/usr/lib64/python3.4/site-packages/nose/case.py"", line 198, in runTest\r\n    self.test(*self.arg)\r\n  File ""/tmp/matplotlib-1.3.1-tests/usr/lib64/python3.4/site-packages/matplotlib/tests/test_basic.py"", line 38, in test_override_builtins\r\n    assert not overridden\r\nnose.proxy.AssertionError:\r\n-------------------- >> begin captured stdout << ---------------------\r\n\'__spec__\' was overridden in globals().\r\n\r\n--------------------- >> end captured stdout << ----------------------\r\n```'"
2808,27500582,fperez,tacaswell,2014-02-13 08:04:57,2014-03-08 03:42:16,2014-03-08 03:42:16,closed,,v1.4.0,12,confirmed bug;mplot3d,https://api.github.com/repos/matplotlib/matplotlib/issues/2808,b'BUG: master has broken some 3d plots',"b'[This 3d example](http://matplotlib.org/examples/mplot3d/trisurf3d_demo.html) from the gallery runs fine in 1.3.1, but on master it produces a warning and a completely broken plot:\r\n\r\n![image](https://f.cloud.github.com/assets/57394/2157795/22b3bda4-9485-11e3-98d6-6b51648f5744.png)\r\n\r\nConfirmed on linux by me and OSX by @ellisonbg.'"
2792,26995072,gnsiva,pelson,2014-02-05 20:33:44,2014-02-10 11:49:44,2014-02-10 11:49:44,closed,,,4,confirmed bug,https://api.github.com/repos/matplotlib/matplotlib/issues/2792,b'Disable legend on matplotlib.axes instance',b'Could we please have the functionality to disable the legend once its been instantiated?\r\n\r\ne.g.\r\n``` python\r\n f = plt.figure()\r\n ax = f.add_subplot(111)\r\n\r\n externalfunction(ax)\r\n\r\n # in the function ax.legend() has been called\r\n # would like to turn off the legend here\r\n\r\n plt.show()\r\n```\r\n\r\nFrom my StackOverflow question (http://stackoverflow.com/questions/21587318/matplotlib-cancel-legend-on-axes-object?noredirect=1#comment32612205_21587318) I have been advised to request this feature.\r\n\r\nI also found the problem could be solved with the hack:\r\n``` python\r\nax.get_legend().set_visible(False)\r\n```'
2732,25634914,glyg,mdboom,2014-01-15 09:29:14,2015-03-03 18:43:39,2014-01-29 14:42:54,closed,,v1.4.0,6,confirmed bug;mplot3d,https://api.github.com/repos/matplotlib/matplotlib/issues/2732,"b""AttributeError: 'Patch3DCollection' object has no attribute 'set_sizes'""","b""Hi,\r\n\r\nI'm running into a bug with `scatter3D` in mplot3d when ran from python 3.3\r\n\r\nI'm using the latest build from github (#e6f899338cb311ad80e89968271944fbdc7b7d7b)\r\n\r\nHere is a minimal example:\r\n```python\r\nimport numpy as np\r\nimport matplotlib.pylab as plt\r\nfrom mpl_toolkits.mplot3d import Axes3D\r\n\r\nfig = plt.figure()\r\nax = fig.add_subplot(111, projection='3d')\r\nax.scatter(np.arange(4), np.arange(4), zs=2)\r\nplt.draw()\r\n```\r\n\r\nIt fails with the following error:\r\n```python\r\nAttributeError: 'Patch3DCollection' object has no attribute 'set_sizes'\r\n\r\n> /home/guillaume/python3/lib/python3.3/site-packages/matplotlib-1.4.x-py3.3-linux-x86_64.egg/matplotlib/collections.py(728)draw()\r\n    727     def draw(self, renderer):\r\n--> 728         self.set_sizes(self._sizes, self.figure.dpi)\r\n    729         Collection.draw(self, renderer)\r\n```\r\nLooks like the `Patch3DCollection` instance doesn't inherits properly from `_CollectionWithSizes`\r\n\r\nBest,\r\n\r\nGuillaume\r\n"""
2688,24495225,NHades,efiring,2013-12-18 15:08:16,2014-06-11 16:58:27,2014-06-11 16:58:27,closed,,v1.4.0,7,confirmed bug,https://api.github.com/repos/matplotlib/matplotlib/issues/2688,b'Deleting axis in matplotlib > v1.2.1 does not work similar to v1.1.1',"b'This issue is described in this Stackoverflow question:\r\n\r\nhttp://stackoverflow.com/questions/17052380/deleting-axis-in-matplotlib-v1-2-1-does-not-work-similar-to-v1-1-1\r\n\r\nI am using matplotlib (python win32 v2.7.5) to plot contour plots with color bars that are animated or the contour gets updated. In order to update the plot, I delete the color bar axis while keeping the original plot axis untouched. In version 1.1.1 of matplotlib, the program was working okay, however, when I upgraded to 1.2.1 (and higher) of matplotlib I started to notice my plot is getting squashed to the left.\r\n\r\nThe following code demos the issues.  Run it in version 1.1.1 and then in 1.2.1 to see the differences. \r\n\r\n```python\r\nimport matplotlib.pyplot as plt\r\nimport numpy as np\r\nfrom matplotlib.mlab import bivariate_normal\r\nfrom matplotlib.colors import LogNorm\r\n\r\ndelta = 0.5\r\nx = np.arange(-3.0, 4.001, delta)\r\ny = np.arange(-4.0, 3.001, delta)\r\nX, Y = np.meshgrid(x, y)\r\nZ = bivariate_normal(X, Y, 1.0, 1.0, 0.0, 0.0)\r\nfig  = plt.figure()\r\nfig.subplots_adjust(left=0.1, bottom=0.1, right=0.97, top=0.92)\r\nax   = fig.add_subplot(1,1,1)\r\naxim = ax.imshow(Z,norm = LogNorm())\r\ncb   = fig.colorbar(axim)\r\n\r\n##Note:  These are not replicated, I put them here to show how a refresh of the \r\n##          contour plot multiple times will look like\r\nfig.delaxes(fig.axes[1])\r\nfig.subplots_adjust(left=0.1, bottom=0.1, right=0.97, top=0.92)\r\ncb   = fig.colorbar(axim)\r\n\r\nfig.delaxes(fig.axes[1])\r\nfig.subplots_adjust(left=0.1, bottom=0.1, right=0.97, top=0.92)\r\ncb   = fig.colorbar(axim)\r\n\r\nplt.show()\r\n```\r\n\r\nIf i delete ALL axis and re-create them each time, then it looks ok even in new version, but I am thinking that this is not efficient process with animation. '"
2675,24157811,breedlun,pelson,2013-12-12 04:53:37,2014-08-07 13:50:13,2014-01-28 09:50:34,closed,,v1.4.0,3,confirmed bug,https://api.github.com/repos/matplotlib/matplotlib/issues/2675,b'clip_on = False does not work for x-axis',"b'When I set clip_on = False the curve extends beyond the y-limits, but it does not extend beyond the x-limits. Am I doing something wrong, or is this a bug?\r\n\r\nFor example, the following code:\r\n\r\n    import matplotlib.pyplot as plt\r\n    import numpy as np\r\n    x1 = np.arange(-10, 10, 0.01)\r\n    y1 = x1\r\n    ax = plt.subplot()\r\n    ax.set_xlim(-2,2)\r\n    ax.set_ylim(-1,1)\r\n    ax.plot(x1, y1, clip_on = False)\r\n\r\nproduces the plot I would expect:\r\n\r\n![good](http://s8.postimg.org/tc0csa3p1/wtf1.jpg)\r\n\r\nHowever, all I have to do is change the y-limits,\r\n\r\n    fig = plt.figure()\r\n    ax = plt.subplot()\r\n    ax.set_xlim(-2,2)\r\n    ax.set_ylim(-3,3)\r\n    ax.plot(x1, y1, clip_on = False)\r\n\r\nand I get the following plot:\r\n\r\n![bad](http://s11.postimg.org/g81ef6r2b/wtf2.jpg)\r\n\r\nWhy does the first plot extend beyond the y-limits, while the second one does not extend beyond the x-limits?  In case it matters, I am using matplotlib 1.3.0 with the TkAgg backend, but apparently (http://stackoverflow.com/questions/20523752/matplotlib-clip-on-false-does-not-work-on-x-axis) it also happens with the MacOSX backend.'"
