issue,id,reporter,closed_by,created_at,updated_at,closed_at,state,assignee,milestone,comments,label_name,url,title,body
3763,48088733,vmarkovtsev,tacaswell,2014-11-07 14:45:11,2015-03-03 18:43:40,2014-11-07 18:09:09,closed,mdboom,2.1 (next point release),5,confirmed bug,https://api.github.com/repos/matplotlib/matplotlib/issues/3763,b'WebAgg: _png.write_png raises TypeError',"b'This looks like a regression after 1.4.x.\r\nTrying to view the plots results in\r\n```python\r\nTraceback (most recent call last):\r\n  File ""/usr/lib/python3/dist-packages/tornado/websocket.py"", line 303, in wrapper\r\n    return callback(*args, **kwargs)\r\n  File ""/usr/lib/python3/dist-packages/matplotlib/backends/backend_webagg.py"", line 229, in on_message\r\n    manager.handle_json(message)\r\n  File ""/usr/lib/python3/dist-packages/matplotlib/backends/backend_webagg_core.py"", line 361, in handle_json\r\n    self.canvas.handle_event(content)\r\n  File ""/usr/lib/python3/dist-packages/matplotlib/backends/backend_webagg_core.py"", line 192, in handle_event\r\n    self.draw()\r\n  File ""/usr/lib/python3/dist-packages/matplotlib/backends/backend_webagg_core.py"", line 90, in draw\r\n    self.manager.refresh_all()\r\n  File ""/usr/lib/python3/dist-packages/matplotlib/backends/backend_webagg_core.py"", line 365, in refresh_all\r\n    diff = self.canvas.get_diff_image()\r\n  File ""/usr/lib/python3/dist-packages/matplotlib/backends/backend_webagg_core.py"", line 147, in get_diff_image\r\n    self._png_buffer)\r\nTypeError: Cannot cast array data from dtype(\'uint32\') to dtype(\'uint8\') according to the rule \'safe\'\r\n```\r\n\r\nlooks like this happened after write_png() API changed.'"
3734,47045625,briantoby,tacaswell,2014-10-28 16:10:00,2015-01-15 17:34:50,2015-01-15 17:34:49,closed,,v1.4.3,6,confirmed bug;GUI/wx;OS/Apple,https://api.github.com/repos/matplotlib/matplotlib/issues/3734,b'Image redraw problem on OSX with wx>2.9 & mpl>1.1',"b'I have seen a problem on more than one Mac running OS X 10.9.x where MPL images are not updated properly. As one example of this, when one zooms a plot, by selecting the zoom widget, the rectangle is never erased and after it is ""released"" the plot is never redrawn with the new limits. This happens when I embed a figure into a wx Panel, as shown in the script below. \r\n\r\nI do not see the problem with EPD (python 2.7.3, wxpython 2.8.10.1, matplotlib 1.1.0), but do with fairly recent Anaconda (python 2.7.8, wxpython 3.0.0.0, matplotlib 1.4.2) and Canopy (python 2.7.6, wxpython 2.9.2.4, matplotlib 1.3.1) dists. \r\n\r\n![mplbug](https://cloud.githubusercontent.com/assets/9433704/4811696/148682b4-5ebc-11e4-87ef-ef8c15c21368.jpg)\r\n\r\n```\r\n# simple demo that fails on Mac (at least on 10.9.5) and later wx/mpl combos\r\n#\r\n# problem is that if one selects the zoom button and drags a region,\r\n# the rectangles never disappear and the image is not updated to\r\n# show the zoomed in region\r\n#\r\n# works (not quite 100%) w/EPD (python 2.7.3, wxpython 2.8.10.1, matplotlib 1.1.0)\r\n# fails w/Anaconda (python 2.7.8, wxpython 3.0.0.0, matplotlib 1.4.2\r\n# fails w/Canopy (python 2.7.6, wxpython 2.9.2.4, matplotlib 1.3.1)\r\n#\r\n\r\nimport sys\r\nimport wx\r\nimport wx.aui\r\nimport matplotlib as mpl\r\nfrom matplotlib.backends.backend_wxagg import FigureCanvasWxAgg as mplCanvas\r\nfrom matplotlib.backends.backend_wxagg import NavigationToolbar2Wx as mplToolbar\r\nprint ""python:     "",sys.version[:5]\r\nprint ""wxpython:   "",wx.__version__\r\nprint ""matplotlib: "",mpl.__version__\r\n\r\napp = wx.PySimpleApp()\r\n\r\n# create frame with notebook\r\nframe = wx.Frame(None, size=(400,400)) \r\nwin = wx.Panel(frame)\r\nwin.nb = wx.aui.AuiNotebook(win)\r\nsizer = wx.BoxSizer(wx.VERTICAL) \r\nsizer.Add(win.nb, 1, wx.EXPAND)\r\nwin.SetSizer(sizer)\r\n\r\n# create a panel for the plot with a plot in it\r\ntab = wx.Panel(win.nb, id=-1)\r\nfigure = mpl.figure.Figure(dpi=None)\r\n# create a quick figure for the plot\r\nax = figure.gca()\r\nax.plot(range(10),range(10),\'o-\')\r\ncanvas = mplCanvas(tab, -1, figure) \r\ntoolbar = mplToolbar(canvas)\r\ntoolbar.Realize()\r\nsizer = wx.BoxSizer(wx.VERTICAL)\r\nsizer.Add(canvas,1,wx.EXPAND)\r\nsizer.Add(toolbar, 0 , wx.LEFT | wx.EXPAND)\r\ntab.SetSizer(sizer)\r\nwin.nb.AddPage(tab,\'plot1\') # add the panel as a notebook tab\r\n\r\nframe.Show()\r\napp.MainLoop()\r\n\r\n```\r\n\r\n'"
3728,46899093,alimuldal,tacaswell,2014-10-27 12:26:25,2014-10-28 16:53:58,2014-10-28 16:52:56,closed,,v1.4.3,1,confirmed bug,https://api.github.com/repos/matplotlib/matplotlib/issues/3728,b'eventplot breaks for default `colors=None` kwarg',"b'To reproduce the bug:\r\n```python\r\nIn [1]: events = np.random.exponential(0.5, size=100)\r\nIn [2]: plt.eventplot(events)\r\n\r\n---------------------------------------------------------------------------\r\nValueError                                Traceback (most recent call last)\r\n<ipython-input-2-51aef4c82a54> in <module>()\r\n----> 1 plt.eventplot(events)\r\n\r\n/usr/lib/pymodules/python2.7/matplotlib/pyplot.pyc in eventplot(positions, orientation, lineoffsets, linelengths, linewidths, colors, linestyles, hold, **kwargs)\r\n   2718                            lineoffsets=lineoffsets, linelengths=linelengths,\r\n   2719                            linewidths=linewidths, colors=colors,\r\n-> 2720                            linestyles=linestyles, **kwargs)\r\n   2721         draw_if_interactive()\r\n   2722     finally:\r\n\r\n/usr/lib/pymodules/python2.7/matplotlib/axes.pyc in eventplot(self, positions, orientation, lineoffsets, linelengths, linewidths, colors, linestyles, **kwargs)\r\n   3981                                          linewidth=linewidth,\r\n   3982                                          color=color,\r\n-> 3983                                          linestyle=linestyle)\r\n   3984             self.add_collection(coll)\r\n   3985             coll.update(kwargs)\r\n\r\n/usr/lib/pymodules/python2.7/matplotlib/collections.pyc in __init__(self, positions, orientation, lineoffset, linelength, linewidth, color, linestyle, antialiased, **kwargs)\r\n   1181                                 antialiaseds=antialiased,\r\n   1182                                 linestyles=linestyle,\r\n-> 1183                                 **kwargs)\r\n   1184 \r\n   1185         self._linelength = linelength\r\n\r\n/usr/lib/pymodules/python2.7/matplotlib/collections.pyc in __init__(self, segments, linewidths, colors, antialiaseds, linestyles, offsets, transOffset, norm, cmap, pickradius, zorder, **kwargs)\r\n    997         self.set_linestyles(linestyles)\r\n    998 \r\n--> 999         colors = mcolors.colorConverter.to_rgba_array(colors)\r\n   1000 \r\n   1001         Collection.__init__(\r\n\r\n/usr/lib/pymodules/python2.7/matplotlib/colors.pyc in to_rgba_array(self, c, alpha)\r\n    390             if isinstance(c, np.ndarray):\r\n    391                 if c.ndim != 2 and c.dtype.kind not in \'SU\':\r\n--> 392                     raise ValueError(""Color array must be two-dimensional"")\r\n    393                 if (c.ndim == 2 and c.shape[1] == 4 and c.dtype.kind == \'f\'):\r\n    394                     if (c.ravel() > 1).any() or (c.ravel() < 0).any():\r\n\r\nValueError: Color array must be two-dimensional\r\n```\r\nIt seems that what\'s happening is that `mcoll.EventCollection()` receives `color=array([None], dtype=object)` and tries to interpret this as a sequence of color values rather than a single value.'"
3722,46841904,marcobardoscia,tacaswell,2014-10-26 12:58:53,2015-03-03 18:43:38,2014-12-31 23:09:56,closed,mdboom,v1.4.3,10,confirmed bug,https://api.github.com/repos/matplotlib/matplotlib/issues/3722,b'semilogx and fill_between produce a segmentation fault',"b'The following code:\r\n``` python\r\nimport numpy as np\r\nimport matplotlib.pyplot as plt\r\n\r\nsteps = 1000\r\ndata = np.arange(steps)\r\nplt.semilogx(data)\r\nplt.fill_between(data, data*0.8, data*1.2)\r\n```\r\nproduces a segfault on matplotlib 1.4.1, while works as expected on 1.3.1. Tested only on MacOSX (Mavericks and Yosemite). Link to the report: http://pastebin.com/8AfSqykw\r\n\r\n'"
3715,46806240,jkseppan,tacaswell,2014-10-25 08:25:05,2015-03-12 23:38:29,2015-03-12 23:38:27,closed,,v1.5.0,1,confirmed bug,https://api.github.com/repos/matplotlib/matplotlib/issues/3715,b'Axis labels only move with spines if there are ticks',"b""The following code plots some random data and moves the spines outward. It works just as expected if it leaves the automatic tick labels alone, but if it disables them the axis labels do not move with the spines. This is on the v1.4.x branch.\r\n\r\n```python\r\nimport numpy as np\r\nfrom matplotlib import pyplot as plt\r\n\r\nfor ticks in True, False:\r\n    fig, ax = plt.subplots(figsize=(10,8), dpi=100)\r\n    plt.subplots_adjust(left=0.3, bottom=0.3)\r\n    data = np.random.uniform(size=100)\r\n    ax.plot(data)\r\n    ax.yaxis.set_ticks_position('left')\r\n    ax.spines['left'].set_position(('outward', 30))\r\n    ax.spines['right'].set_visible(False)\r\n    ax.set_ylabel('random numbers')\r\n    ax.xaxis.set_ticks_position('bottom')\r\n    ax.spines['bottom'].set_position(('outward', 30))\r\n    ax.spines['top'].set_visible(False)\r\n    ax.set_xlabel('sequence')\r\n    if not ticks:\r\n        ax.xaxis.set_ticks([])\r\n        ax.yaxis.set_ticks([])\r\n    plt.savefig('ticks-%s.png' % ticks)\r\n```\r\n\r\nThe output with ticks enabled:\r\n\r\n![ticks-true](https://cloud.githubusercontent.com/assets/92814/4779199/0a975b3c-5c20-11e4-9ce5-a07e61f0b99c.png)\r\n\r\nand with ticks disabled:\r\n\r\n![ticks-false](https://cloud.githubusercontent.com/assets/92814/4779203/162d27ba-5c20-11e4-9838-270df52711ad.png)\r\n\r\n"""
3709,46620288,espdev,efiring,2014-10-23 12:45:36,2015-01-25 19:50:56,2015-01-25 19:50:56,closed,efiring,v1.4.x,8,confirmed bug,https://api.github.com/repos/matplotlib/matplotlib/issues/3709,b'quiver does not consider direction of an axis',"b""I'm trying to plot imshow (**it inverts Y-axis**) and quiver on the same axes and I see the incorrect direction of vectors for Y-axis. In MATLAB the analogous code working correctly.\r\n\r\nMy code for example:\r\n```python\r\nimport numpy as np\r\nimport scipy.ndimage as ndimage\r\nimport matplotlib.pyplot as plt\r\n\r\nh = 100\r\nw = 100\r\n\r\n# test image (white square)\r\nimage = np.zeros((h, w))\r\nimage[20:79, 20:79] = 1\r\n\r\n# compute X, Y gradients\r\ngx = ndimage.convolve1d(image, [1, 0, -1], axis=1)\r\ngy = ndimage.convolve1d(image, [1, 0, -1], axis=0)\r\n\r\n# compute magnitude\r\nmg = np.hypot(gx, gy)\r\n\r\n# grid for quiver\r\nx, y = np.meshgrid(np.arange(0, w), np.arange(0, h))\r\n\r\nfig, ax = plt.subplots(2, 1)\r\nax1, ax2 = ax\r\n\r\nax1.set_title('Gradient mag image and Quiver')\r\nax1.imshow(mg, cmap=plt.cm.gray)\r\nax1.quiver(x, y, gx, gy, color='g')\r\n\r\nax2.set_title('Gradient Quiver')\r\nax2.set_xlim([0, w])\r\nax2.set_ylim([0, h])\r\nax2.set_aspect('equal')\r\nax2.quiver(x, y, gx, gy, color='g')\r\n\r\nplt.show()\r\n```\r\n\r\n![image](http://habrastorage.org/files/492/dba/371/492dba371bc24f29bd45c569027d9ebf.PNG)\r\n"""
3633,45520547,dukecld,tacaswell,2014-10-10 20:27:08,2015-01-27 06:11:09,2015-01-27 06:11:06,closed,,v1.4.3,3,confirmed bug,https://api.github.com/repos/matplotlib/matplotlib/issues/3633,b'twinx clear problem',"b""With matplotlib 1.4.0 the cla() method for the twinx axes also clears the primary axes.  With matplotlib 1.3.1 the method only clears the twinx axes as expected.  I have a much longer program where the twinx axes must be cleared while retaining the primary axis plot.  I would prefer not to replot the entire graph each time the twinx axes change.  You can see this by adding the cla method to the matplotlib web site example, two_scales.py, shown below.\r\n\r\nI have matplotlib installed via the anaconda package. Matplotlib 1.4.0 is from anaconda 2.1.0.  Matplotlib 1.3.1 is from 1.9 versions of the anaconda package.\r\n\r\nLinux version:\r\nLinux gamow 3.2.0-4-amd64 #1 SMP Debian 3.2.60-1+deb7u3 x86_64 GNU/Linux\r\nSame cla() result on osX 10.9.4.\r\n\r\nSame result for backends Qt4Agg and TkAgg;  the cla() method cleared both axes.\r\nI also tried various other options such as setting ax2.hold(False) prior to replotting  ax2.  However, once again ax1 was cleared.  The ax2 clear commands seem to apply to the ax1 axis as well???  These options worked as expected  for the earlier matplotlib version, clearing only the ax2 axis.\r\n\r\nHere\xa1\xafs the code:  if you execute the code, you should see a blank figure with the cla() included and the usual two graphs without the cla() method.\r\n\r\n--------------------------------------------------------------------\r\n```python\r\nimport numpy as np\r\nimport matplotlib.pyplot as plt\r\n\r\nfig, ax1 = plt.subplots()\r\nt = np.arange(0.01, 10.0, 0.01)\r\ns1 = np.exp(t)\r\nax1.plot(t, s1, 'b-')\r\nax1.set_xlabel('time (s)')\r\n# Make the y-axis label and tick labels match the line color.\r\nax1.set_ylabel('exp', color='b')\r\nfor tl in ax1.get_yticklabels():\r\n    tl.set_color('b')\r\n\r\nax2 = ax1.twinx()\r\ns2 = np.sin(2*np.pi*t)\r\nax2.plot(t, s2, 'r.')\r\nax2.set_ylabel('sin', color='r')\r\nfor tl in ax2.get_yticklabels():\r\n    tl.set_color('r')\r\n\r\n# single line addition to the two_scales.py example\r\n# clears both ax2 and ax1 under matplotlib 1.4.0, clears only ax2 under matplotlib 1.3.1\r\n# obviously, same result with ax2.clear() method\r\nax2.cla()\r\n\r\nplt.show()\r\n```\r\n\r\nI would appreciate any help;  this looks like a bug in the latest version of matplotlib.\r\nI could not find any reference to this problem in earlier posts.\r\n\r\nThanks,\r\nCharlie\r\n\r\n\r\n[TAC edited for markup]"""
3626,45331114,nicktimko,mdboom,2014-10-09 06:06:55,2014-12-27 22:51:51,2014-12-27 22:51:50,closed,,v1.4.3,8,confirmed bug;needs_patch,https://api.github.com/repos/matplotlib/matplotlib/issues/3626,"b'Manual xlim log stackplots not showing, linear stackplots segfault'","b""I was trying to make some hacky split axes, things didn't show up, thought it was me, then after trying to make a SSCCE and getting it to segfault I think it's maybe only 90% me.\r\n\r\n    import numpy as np\r\n    import matplotlib.pyplot as plt\r\n\r\n    f, ax = plt.subplots()\r\n    #ax.set_xlim(10**-10, 1) # works\r\n    ax.set_xlim(10**-9.2679, 1) # sometimes broken\r\n    #ax.set_xlim(10**-4, 1) # broken\r\n\r\n    x = np.logspace(-10, 5, 20)\r\n    data = np.random.random((2, 20))\r\n    ax.set_xscale('log') # segfaults instead of just not showing if commented\r\n    ax.stackplot(x, *data)\r\n\r\n    f.show()\r\n\r\nUncomment as commented to reproduce. It randomly doesn't work on the seemingly-arbitrary lower bound (`10**-9.2679`).\r\n\r\nThe real fun seems to be if you comment out `ax.set_xscale('log')`, then Python simply segfaults when attempting to either `f.show()` or `f.savefig('test')` (after any of the provided `set_xlim` calls).\r\n\r\nRepro'd on\r\n* MPL 1.4.0\r\n    * Ubuntu 14.04 64-bit, Python 2.7.8 (64-bit), Numpy 1.8.2, TkAgg\r\n    * Windows 7 64-bit, Python 3.4.1 (64-bit), Numpy 1.9.0, TkAgg and Agg\r\n    * *(with variant, see below)* OS X 10.9.5, Python 3.4.1/2.7.8, Numpy 1.9.0, MacOSX and Agg"""
3622,45167577,mdboom,tacaswell,2014-10-07 21:03:17,2015-03-03 18:43:45,2014-10-10 18:42:18,closed,mdboom,v1.4.1,6,confirmed bug,https://api.github.com/repos/matplotlib/matplotlib/issues/3622,"b'setup.py creates a zombie C extension called ""freetype2""'","b'Since #3067, there has been a useless and unimportable extension created as part of the matplotlib install.  We need to remove it.\r\n\r\nHowever, it reportedly fixes a real bug for some, but it\'s not quite clear how.  I\'ll poke around and see if I can break/fix it in the same way as the original reports and then find a better solution that doesn\'t install a broken `.so` file.\r\n\r\n```\r\n>>> import freetype2\r\nTraceback (most recent call last):\r\n  File ""<stdin>"", line 1, in <module>\r\nImportError: dynamic module does not define init function (initfreetype2)\r\n```\r\n\r\nThe name of matplotlib\'s freetype wrapper is ft2font, not freetype2.'"
3574,44173682,tonysyu,tacaswell,2014-09-27 14:10:09,2015-03-03 18:44:27,2014-09-30 15:26:01,closed,mdboom,v1.4.x,4,confirmed bug,https://api.github.com/repos/matplotlib/matplotlib/issues/3574,b'`rotation` parameter has no effect on `RegularPolyCollection`',"b""It looks like the `rotation` parameter in `RegularPolyCollection` was disconnected in the following commit: https://github.com/matplotlib/matplotlib/commit/b8726d09026ba7507d8501de0fbd921ec2d1243e\r\n\r\nBelow is an example that *should* display squares with different rotations, but doesn't on master or 1.4.0.\r\n\r\n```python\r\nimport matplotlib.pyplot as plt\r\nfrom matplotlib.collections import RegularPolyCollection\r\nimport numpy as np\r\n\r\n\r\nxx, yy = np.mgrid[:10, :10]\r\nxy_points = np.transpose([xx.flatten(), yy.flatten()])\r\nrotations = np.linspace(0, 2*np.pi, len(xy_points))\r\n\r\nfig, ax = plt.subplots()\r\nfor xy, alpha in zip(xy_points, rotations):\r\n    col = RegularPolyCollection(4, sizes=(100,), rotation=alpha,\r\n                                offsets=xy, transOffset=ax.transData)\r\n    ax.add_collection(col, autolim=True)\r\nax.autoscale_view()\r\n\r\nplt.show()\r\n```"""
3557,43589090,nhmc,tacaswell,2014-09-23 04:08:14,2015-01-13 05:08:53,2015-01-13 05:08:47,closed,,v1.4.x,6,confirmed bug;hackathon;needs_patch,https://api.github.com/repos/matplotlib/matplotlib/issues/3557,b'Bug fix for plotting minor ticks',"b""When using `AutoMinorlocator` the rightmost minor tick isn't drawn sometimes (in Matplotlib 1.4).  Changing this line in `class AutoMinorLocator(Locator)` (in `ticker.py`) from:\r\n\r\n```\r\ntmax = np.floor((vmax - t0) / minorstep) * minorstep\r\n```\r\n\r\nto\r\n\r\n```\r\n tmax = np.ceil((vmax - t0) / minorstep) * minorstep\r\n```\r\n\r\nfixes this. I don't completely understand the code though, so this may not be the best fix.\r\n"""
3553,43545731,marcopigg,tacaswell,2014-09-22 20:16:56,2015-01-22 16:20:43,2014-11-21 13:21:19,closed,,v1.4.x,10,confirmed bug,https://api.github.com/repos/matplotlib/matplotlib/issues/3553,b'fill_between disappears on axis limit change',"b'Running the fill_between_demo.py, if I zoom on figure 1 the fill_between shape disappears. Figure 2 and 3 instead zoom in correctly. It looks like this also happens when calling ax.set_xlim() in a python script, after fill_between has been called.\r\n\r\nI am using matplotlib version 1.4.0 on Linux. This affects both python 2.7.8 and 3.4.1, and both Linux 32 bit and 64bit.\r\n\r\nmatplotlib 1.3.1 is not affected by this bug.'"
3522,42882208,Horrifior,tacaswell,2014-09-16 13:35:58,2014-09-27 03:49:50,2014-09-27 03:49:50,closed,,,1,confirmed bug,https://api.github.com/repos/matplotlib/matplotlib/issues/3522,b'Inverting a datetime / plot_date y-axis',"b'Dear all,\r\n\r\nthere have been few mails using the same topic-name on the matplotlib-user mailinglist today, and as suggested by some other users there could be a bug associated with inverting axis using datetime-objects... for brevity, I just attach the short code snippet which should show the problem:\r\n\r\n\r\nThis code is running fine as long as any of the two commands intended to invert the y-axis are commented out. \r\n\r\n```python\r\nimport matplotlib.pyplot; matplotlib.pyplot.rcdefaults()\r\n\r\nimport numpy\r\nimport matplotlib.pyplot\r\nimport datetime\r\n\r\ndef plot_grid(ax):\r\n    grid_x=numpy.arange(17)+0.5\r\n    grid_y=[]\r\n\r\n    for y in range(2013,2019):\r\n        for m in range(1,13,3):\r\n            grid_y+=[matplotlib.dates.date2num(datetime.datetime.strptime(""01.""+str(m)+"".""+str(y)+"" 0:00"", ""%d.%m.%Y %H:%M""))]\r\n    for i in range(len(grid_x)):\r\n        matplotlib.pyplot.plot_date([grid_x[i],grid_x[i]], [grid_y[0],grid_y[-1]],\'k\', xdate=False, ydate=True)\r\n    for i in range(len(grid_y)):\r\n        matplotlib.pyplot.plot_date([grid_x[0],grid_x[-1]],[grid_y[i],grid_y[i]],\'k\', xdate=False, ydate=True)\r\n\r\n\r\nymin=matplotlib.dates.date2num(datetime.datetime.strptime(""01.""+str(1)+"".""+str(2013)+"" 0:00"", ""%d.%m.%Y %H:%M""))\r\nymax=matplotlib.dates.date2num(datetime.datetime.strptime(""01.""+str(12)+"".""+str(2018)+"" 0:00"", ""%d.%m.%Y %H:%M""))\r\nfig, ax = matplotlib.pyplot.subplots()\r\nplot_grid(ax)\r\n\r\n##matplotlib.pyplot.ylim(ymax,ymin)\r\n##ax.invert_yaxis()\r\nmatplotlib.pyplot.savefig(\'test.png\')\r\nmatplotlib.pyplot.show()\r\n```\r\n\r\n[TAC edited to introduce formatting]'"
3514,42721177,astrofrog,tacaswell,2014-09-14 14:02:45,2015-03-03 18:44:05,2014-09-27 18:13:11,closed,mdboom,v1.4.1,8,confirmed bug;needs_review,https://api.github.com/repos/matplotlib/matplotlib/issues/3514,"b""Ticks on top axis disappear if tick size is too large (when using bbox_inches='tight')""","b""This is a bug in Matplotlib 1.4 - the following script:\r\n\r\n```python\r\nimport matplotlib.pyplot as plt\r\n\r\nfig = plt.figure()\r\nax = fig.add_subplot(1,1,1)\r\nax.plot([1,2,3])\r\n\r\nfor line in ax.xaxis.get_ticklines():\r\n    line.set_markersize(17)\r\n\r\nfor line in ax.yaxis.get_ticklines():\r\n    line.set_markersize(17)\r\n\r\nfig.savefig('ticks.png', bbox_inches='tight')\r\n```\r\n\r\nproduces the following output when using ``bbox_inches='tight'``:\r\n\r\n![ticks](https://cloud.githubusercontent.com/assets/314716/4264156/b005ecc4-3c17-11e4-9c2a-c0bdad25f1fe.png)\r\n\r\nWhen not setting ``bbox_inches='tight'``, the ticks are there:\r\n\r\n![ticks](https://cloud.githubusercontent.com/assets/314716/4264157/c2b3a08c-3c17-11e4-820e-7b4970897089.png)\r\n\r\nAddendum:  it turns out I noticed this because some of the image tests in my package were failing - however, this only caused an RMS difference of ~2 or so, so the tolerance has to be quite low to catch this!\r\n"""
3493,42406254,michaelwimmer,tacaswell,2014-09-10 12:16:15,2014-09-13 15:58:44,2014-09-13 15:58:44,closed,,v1.4.x,0,confirmed bug;mplot3d,https://api.github.com/repos/matplotlib/matplotlib/issues/3493,b'Incorrect use of super() in mplot3d?',"b'I have a number of custom collections that derive from matplotlib Collections. Since 1.4, I have the problem that my code breaks when the init function of my code calls the init function of the mplot3d collection:\r\n```\r\n/mplot3d/art3d.py"", line 322, in __init__\r\n    super(self.__class__, self).__init__(*args, **kwargs)\r\nRuntimeError: maximum recursion depth exceeded while calling a Python object\r\n```\r\nI researched the issue, and in general it is discouraged to use `super(self.__class, ...)` as it breaks when classes are derived (see e.g. [Stackoverflow](http://stackoverflow.com/questions/18208683/when-calling-super-in-a-derived-class-can-i-pass-in-self-class) ). Is there a special reason why this is there?'"
3483,42145924,mdepitta,efiring,2014-09-07 16:31:45,2015-02-28 23:58:26,2015-02-28 23:58:26,closed,,unassigned,6,confirmed bug;won't fix,https://api.github.com/repos/matplotlib/matplotlib/issues/3483,b'Cannot properly reload figure that was previously pickled',"b'Dear all,\r\nI just figure out that matplotlib does not have apparently a simple way to save interactive plots as MATLAB ""fig"" figures. I sincerely hope the ""experimental"" pickling will be soon consolidated because it would be of great benefit for users imho.\r\n\r\nBriefly, I followed the simple procedure outlined here in order to pickle and reload figures:\r\nhttp://stackoverflow.com/questions/7290370/store-and-reload-matplotlib-pyplot-object\r\n\r\nIt seems that I am able to pickle the figure indeed, but not to reload it properly.\r\nThis is what I get:\r\n\r\n```\r\nTraceback (most recent call last):\r\n  File ""/usr/lib64/python2.7/site-packages/matplotlib/backends/backend_qt4.py"", line 299, in resizeEvent\r\n    self.draw()\r\n  File ""/usr/lib64/python2.7/site-packages/matplotlib/backends/backend_qt4agg.py"", line 154, in draw\r\n    FigureCanvasAgg.draw(self)\r\n  File ""/usr/lib64/python2.7/site-packages/matplotlib/backends/backend_agg.py"", line 451, in draw\r\n    self.figure.draw(self.renderer)\r\n  File ""/usr/lib64/python2.7/site-packages/matplotlib/artist.py"", line 55, in draw_wrapper\r\n    draw(artist, renderer, *args, **kwargs)\r\n  File ""/usr/lib64/python2.7/site-packages/matplotlib/figure.py"", line 1031, in draw\r\n    dsu = [row for row in dsu if not row[1].get_animated()]\r\n  File ""/usr/lib64/python2.7/site-packages/matplotlib/artist.py"", line 612, in get_animated\r\n    return self._animated\r\nAttributeError: \'AxesSubplot\' object has no attribute \'_animated\'\r\n```\r\n\r\nAny suggestion? Shall I bother about this?\r\nI am using matplotlib 1.3.1 on Fedora 20 with QtAgg backend.\r\n\r\nThanks for your time,\r\n\r\nMaurizio'"
