issue,id,reporter,closed_by,created_at,updated_at,closed_at,state,assignee,milestone,comments,label_name,url,title,body
6509,157607745,efiring,QuLogic,2016-05-31 07:36:50,2016-07-10 01:05:23,2016-07-10 01:05:23,closed,mdboom,2.0 (style change major release),12,confirmed bug;Release critical,https://api.github.com/repos/matplotlib/matplotlib/issues/6509,b'pylab image_masked is broken',"b'It looks like the input values are getting clipped instead of registering as over and under.\r\n\r\nWith v2.x:\r\n![image_masked_v2](https://cloud.githubusercontent.com/assets/85125/15666726/134b9824-26ae-11e6-84ed-02fbb4b731f6.png)\r\n\r\nIt should look like this, from v1.5:\r\n![image_masked_v1 5](https://cloud.githubusercontent.com/assets/85125/15666787/61d4044a-26ae-11e6-8e92-50480ca2fbd3.png)\r\n\r\n'"
6276,146449255,peynmurray,tacaswell,2016-04-06 22:06:50,2016-05-16 20:59:53,2016-05-16 20:59:50,closed,tacaswell,1.5.2 (Critical bug fix release),2,confirmed bug;GUI/Qt,https://api.github.com/repos/matplotlib/matplotlib/issues/6276,b'Ticklabel format not preserved after editing plot limits',"b'Version: 1.5.1, Windows 7, using QT5 backend. Not tested on linux yet. After setting the format of an axis to use use scientific notation,\r\n\r\n`ticklabel_format(style=\'sci\', axis=\'y\', scilimits=(0,0))`\r\n\r\nchanging the limits of the plot using the green checkbox widget in the NavigationToolbar will remove the scientific notation formatting that was just set. This would be a huge convenience for users who use scientific notation and want to work with plots interactively. Example:\r\n\r\n```\r\nimport matplotlib\r\nmatplotlib.use(""Qt5Agg"")\r\nfrom numpy import *\r\nfrom matplotlib.pyplot import *\r\nfrom numpy.random import uniform\r\n\r\nnpts = 1000\r\n\r\nx = uniform(-100, 100, npts)\r\ny = 1000*sin(x)*cos(x**2)\r\n\r\nplot(x, y)\r\nticklabel_format(style=\'sci\', axis=\'both\', scilimits=(0,0))\r\n\r\nshow()\r\n```'"
6270,146125368,w2naf,tacaswell,2016-04-05 22:32:38,2016-05-16 13:47:19,2016-05-16 13:47:15,closed,efiring,1.5.2 (Critical bug fix release),4,confirmed bug,https://api.github.com/repos/matplotlib/matplotlib/issues/6270,b'pyplot.contour() not working with matplotlib.ticker.LinearLocator()',"b'Hello. Code using `matplotlib.ticker.LinearLocator()` with `pyplot.contour()` does not work anymore. I have tested other `matplotlib.ticker` subclasses (such as `LogLocator()` and `AutoLocator()`) which have worked fine. Please see the attached example and debug trace.\r\n\r\nThank you,\r\nNathaniel\r\n\r\n    Matplotlib version: 1.5.1 (installed by cloning git repository, then using sudo pip install -e .)\r\n    Python version: Python 2.7.3 (default, Jun 22 2015, 19:33:41)\r\n    Platform: Ubuntu 12.04\r\n\r\nExample based on: http://matplotlib.org/examples/pylab_examples/contour_demo.html\r\n```python\r\n#!/usr/bin/env python\r\n""""""\r\nIllustrate simple contour plotting, contours on an image with\r\na colorbar for the contours, and labelled contours.\r\n\r\nSee also contour_image.py.\r\n""""""\r\nimport matplotlib\r\nimport numpy as np\r\nimport matplotlib.cm as cm\r\nimport matplotlib.mlab as mlab\r\nimport matplotlib.pyplot as plt\r\n\r\nmatplotlib.rcParams[\'xtick.direction\'] = \'out\'\r\nmatplotlib.rcParams[\'ytick.direction\'] = \'out\'\r\n\r\ndelta = 0.025\r\nx = np.arange(-3.0, 3.0, delta)\r\ny = np.arange(-2.0, 2.0, delta)\r\nX, Y = np.meshgrid(x, y)\r\nZ1 = mlab.bivariate_normal(X, Y, 1.0, 1.0, 0.0, 0.0)\r\nZ2 = mlab.bivariate_normal(X, Y, 1.5, 0.5, 1, 1)\r\n# difference of Gaussians\r\nZ = 10.0 * (Z2 - Z1)\r\n\r\n\r\n# Create a simple contour plot with labels using default colors.  The\r\n# inline argument to clabel will control whether the labels are draw\r\n# over the line segments of the contour, removing the lines beneath\r\n# the label\r\nplt.figure()\r\nCS = plt.contour(X, Y, Z,locator=matplotlib.ticker.LinearLocator(10))\r\nplt.clabel(CS, inline=1, fontsize=10)\r\nplt.title(\'Simplest default with labels\')\r\n```\r\nOutput trace:\r\n```pytb\r\n---------------------------------------------------------------------------\r\nTypeError                                 Traceback (most recent call last)\r\n<ipython-input-13-37a1d06c84a1> in <module>()\r\n     30 # the label\r\n     31 plt.figure()\r\n---> 32 CS = plt.contour(X, Y, Z,locator=matplotlib.ticker.LinearLocator(10))\r\n     33 plt.clabel(CS, inline=1, fontsize=10)\r\n     34 plt.title(\'Simplest default with labels\')\r\n\r\n/home/w2naf/code/matplotlib/lib/matplotlib/pyplot.pyc in contour(*args, **kwargs)\r\n   2764         ax.hold(hold)\r\n   2765     try:\r\n-> 2766         ret = ax.contour(*args, **kwargs)\r\n   2767     finally:\r\n   2768         ax.hold(washold)\r\n\r\n/home/w2naf/code/matplotlib/lib/matplotlib/__init__.pyc in inner(ax, *args, **kwargs)\r\n   1810                     warnings.warn(msg % (label_namer, func.__name__),\r\n   1811                                   RuntimeWarning, stacklevel=2)\r\n-> 1812             return func(ax, *args, **kwargs)\r\n   1813         pre_doc = inner.__doc__\r\n   1814         if pre_doc is None:\r\n\r\n/home/w2naf/code/matplotlib/lib/matplotlib/axes/_axes.pyc in contour(self, *args, **kwargs)\r\n   5642             self.cla()\r\n   5643         kwargs[\'filled\'] = False\r\n-> 5644         return mcontour.QuadContourSet(self, *args, **kwargs)\r\n   5645     contour.__doc__ = mcontour.QuadContourSet.contour_doc\r\n   5646 \r\n\r\n/home/w2naf/code/matplotlib/lib/matplotlib/contour.pyc in __init__(self, ax, *args, **kwargs)\r\n   1422         are described in QuadContourSet.contour_doc.\r\n   1423         """"""\r\n-> 1424         ContourSet.__init__(self, ax, *args, **kwargs)\r\n   1425 \r\n   1426     def _process_args(self, *args, **kwargs):\r\n\r\n/home/w2naf/code/matplotlib/lib/matplotlib/contour.pyc in __init__(self, ax, *args, **kwargs)\r\n    861         self._transform = kwargs.get(\'transform\', None)\r\n    862 \r\n--> 863         self._process_args(*args, **kwargs)\r\n    864         self._process_levels()\r\n    865 \r\n\r\n/home/w2naf/code/matplotlib/lib/matplotlib/contour.pyc in _process_args(self, *args, **kwargs)\r\n   1443                 self._corner_mask = mpl.rcParams[\'contour.corner_mask\']\r\n   1444 \r\n-> 1445             x, y, z = self._contour_args(args, kwargs)\r\n   1446 \r\n   1447             _mask = ma.getmask(z)\r\n\r\n/home/w2naf/code/matplotlib/lib/matplotlib/contour.pyc in _contour_args(self, args, kwargs)\r\n   1538             warnings.warn(\'Log scale: values of z <= 0 have been masked\')\r\n   1539             self.zmin = z.min()\r\n-> 1540         self._contour_level_args(z, args)\r\n   1541         return (x, y, z)\r\n   1542 \r\n\r\n/home/w2naf/code/matplotlib/lib/matplotlib/contour.pyc in _contour_level_args(self, z, args)\r\n   1167         if self.levels is None:\r\n   1168             if len(args) == 0:\r\n-> 1169                 lev = self._autolev(z, 7)\r\n   1170             else:\r\n   1171                 level_arg = args[0]\r\n\r\n/home/w2naf/code/matplotlib/lib/matplotlib/contour.pyc in _autolev(self, z, N)\r\n   1149         zmax = self.zmax\r\n   1150         zmin = self.zmin\r\n-> 1151         lev = self.locator.tick_values(zmin, zmax)\r\n   1152         self._auto = True\r\n   1153         if self.filled:\r\n\r\n/home/w2naf/code/matplotlib/lib/matplotlib/ticker.pyc in tick_values(self, vmin, vmax)\r\n   1173             vmin, vmax = vmax, vmin\r\n   1174 \r\n-> 1175         if (vmin, vmax) in self.presets:\r\n   1176             return self.presets[(vmin, vmax)]\r\n   1177 \r\n\r\nTypeError: unhashable type: \'MaskedArray\'\r\n```'"
6266,145464804,janschulz,WeatherGod,2016-04-03 07:36:52,2016-04-08 18:09:12,2016-04-08 18:09:08,closed,efiring,2.1 (next point release),3,confirmed bug;Difficulty: Medium,https://api.github.com/repos/matplotlib/matplotlib/issues/6266,b'Better fallback when color is a float',"b'I\'m using matplotlib via the ""new"" data interface and with cartopy (all latest conda env with conda-forge and py3.5).\r\n\r\n```\r\nax.scatter(""lon"", ""lat"", color=""sum_prob"", lw = 0, data=good_data, transform=ll_proj)\r\n```\r\n\r\nI get the following error message:\r\n\r\n```pytb\r\n---------------------------------------------------------------------------\r\nValueError                                Traceback (most recent call last)\r\nC:\\portabel\\miniconda\\envs\\zalando\\lib\\site-packages\\matplotlib\\colors.py in to_rgba(self, arg, alpha)\r\n    367                     raise ValueError(\r\n--> 368                             \'length of rgba sequence should be either 3 or 4\')\r\n    369             else:\r\n\r\nValueError: length of rgba sequence should be either 3 or 4\r\n\r\nDuring handling of the above exception, another exception occurred:\r\n\r\nValueError                                Traceback (most recent call last)\r\nC:\\portabel\\miniconda\\envs\\zalando\\lib\\site-packages\\matplotlib\\colors.py in to_rgba_array(self, c, alpha)\r\n    398             # Single value? Put it in an array with a single row.\r\n--> 399             return np.array([self.to_rgba(c, alpha)], dtype=np.float)\r\n    400         except ValueError:\r\n\r\nC:\\portabel\\miniconda\\envs\\zalando\\lib\\site-packages\\matplotlib\\colors.py in to_rgba(self, arg, alpha)\r\n    375             raise ValueError(\r\n--> 376                 \'to_rgba: Invalid rgba arg ""%s""\\n%s\' % (str(arg), exc))\r\n    377 \r\n\r\nValueError: to_rgba: Invalid rgba arg ""6574    0.000165\r\n6674    0.000167\r\n6774    0.000168\r\n6873    0.000165\r\n6874    0.000170\r\n6973    0.000166\r\n6974    0.000171\r\n7073    0.000167\r\n7074    0.000173\r\n7172    0.000163\r\n7173    0.000168\r\n7174    0.000174\r\n7272    0.000164\r\n7273    0.000169\r\n7274    0.000176\r\n7372    0.000165\r\n7373    0.000170\r\n7374    0.000177\r\n7472    0.000166\r\n7473    0.000172\r\n7474    0.000179\r\n7571    0.000162\r\n7572    0.000167\r\n7573    0.000173\r\n7574    0.000181\r\n7671    0.000163\r\n7672    0.000168\r\n7673    0.000175\r\n7674    0.000183\r\n7771    0.000163\r\n          ...   \r\n9670    0.000193\r\n9671    0.000207\r\n9672    0.000221\r\n9673    0.000236\r\n9765    0.000138\r\n9766    0.000148\r\n9767    0.000158\r\n9768    0.000170\r\n9769    0.000183\r\n9770    0.000196\r\n9771    0.000211\r\n9772    0.000226\r\n9864    0.000130\r\n9865    0.000140\r\n9866    0.000150\r\n9867    0.000161\r\n9868    0.000173\r\n9869    0.000186\r\n9870    0.000200\r\n9871    0.000215\r\n9872    0.000230\r\n9964    0.000131\r\n9965    0.000142\r\n9966    0.000152\r\n9967    0.000163\r\n9968    0.000176\r\n9969    0.000189\r\n9970    0.000204\r\n9971    0.000219\r\n9972    0.000234\r\nName: sum_prob, dtype: float64""\r\nlength of rgba sequence should be either 3 or 4\r\n\r\nDuring handling of the above exception, another exception occurred:\r\n\r\nValueError                                Traceback (most recent call last)\r\nC:\\portabel\\miniconda\\envs\\zalando\\lib\\site-packages\\matplotlib\\colors.py in to_rgb(self, arg)\r\n    321                 raise ValueError(\r\n--> 322                     \'cannot convert argument to rgb sequence\')\r\n    323 \r\n\r\nValueError: cannot convert argument to rgb sequence\r\n\r\nDuring handling of the above exception, another exception occurred:\r\n\r\nValueError                                Traceback (most recent call last)\r\nC:\\portabel\\miniconda\\envs\\zalando\\lib\\site-packages\\matplotlib\\colors.py in to_rgba(self, arg, alpha)\r\n    369             else:\r\n--> 370                 r, g, b = self.to_rgb(arg)\r\n    371             if alpha is None:\r\n\r\nC:\\portabel\\miniconda\\envs\\zalando\\lib\\site-packages\\matplotlib\\colors.py in to_rgb(self, arg)\r\n    327             raise ValueError(\r\n--> 328                 \'to_rgb: Invalid rgb arg ""%s""\\n%s\' % (str(arg), exc))\r\n    329             # Error messages could be improved by handling TypeError\r\n\r\nValueError: to_rgb: Invalid rgb arg ""0.000165462141918""\r\ncannot convert argument to rgb sequence\r\n\r\nDuring handling of the above exception, another exception occurred:\r\n\r\nValueError                                Traceback (most recent call last)\r\n<ipython-input-40-c01684ee4af6> in <module>()\r\n     22 #plt.show()\r\n     23 \r\n---> 24 ax.scatter(""lon"", ""lat"", color=good_data[""sum_prob""], lw = 0, data=good_data, transform=ll_proj)\r\n     25 #ax.scatter(""lon"", ""lat"", color=""sum_prob"", lw = 0, data=best, transform=ll_proj)\r\n\r\nC:\\portabel\\miniconda\\envs\\zalando\\lib\\site-packages\\cartopy\\mpl\\geoaxes.py in scatter(self, *args, **kwargs)\r\n   1179                              \'(PlateCarree or RotatedPole).\')\r\n   1180 \r\n-> 1181         result = matplotlib.axes.Axes.scatter(self, *args, **kwargs)\r\n   1182         self.autoscale_view()\r\n   1183         return result\r\n\r\nC:\\portabel\\miniconda\\envs\\zalando\\lib\\site-packages\\matplotlib\\__init__.py in inner(ax, *args, **kwargs)\r\n   1809                     warnings.warn(msg % (label_namer, func.__name__),\r\n   1810                                   RuntimeWarning, stacklevel=2)\r\n-> 1811             return func(ax, *args, **kwargs)\r\n   1812         pre_doc = inner.__doc__\r\n   1813         if pre_doc is None:\r\n\r\nC:\\portabel\\miniconda\\envs\\zalando\\lib\\site-packages\\matplotlib\\axes\\_axes.py in scatter(self, x, y, s, c, marker, cmap, norm, vmin, vmax, alpha, linewidths, verts, edgecolors, **kwargs)\r\n   3891                 offsets=offsets,\r\n   3892                 transOffset=kwargs.pop(\'transform\', self.transData),\r\n-> 3893                 alpha=alpha\r\n   3894                 )\r\n   3895         collection.set_transform(mtransforms.IdentityTransform())\r\n\r\nC:\\portabel\\miniconda\\envs\\zalando\\lib\\site-packages\\matplotlib\\collections.py in __init__(self, paths, sizes, **kwargs)\r\n    829         """"""\r\n    830 \r\n--> 831         Collection.__init__(self, **kwargs)\r\n    832         self.set_paths(paths)\r\n    833         self.set_sizes(sizes)\r\n\r\nC:\\portabel\\miniconda\\envs\\zalando\\lib\\site-packages\\matplotlib\\collections.py in __init__(self, edgecolors, facecolors, linewidths, linestyles, antialiaseds, offsets, transOffset, norm, cmap, pickradius, hatch, urls, offset_position, zorder, **kwargs)\r\n    114         cm.ScalarMappable.__init__(self, norm, cmap)\r\n    115 \r\n--> 116         self.set_edgecolor(edgecolors)\r\n    117         self.set_facecolor(facecolors)\r\n    118         self.set_linewidth(linewidths)\r\n\r\nC:\\portabel\\miniconda\\envs\\zalando\\lib\\site-packages\\matplotlib\\collections.py in set_edgecolor(self, c)\r\n    658             c = mpl.rcParams[\'patch.edgecolor\']\r\n    659         self._edgecolors_original = c\r\n--> 660         self._edgecolors = mcolors.colorConverter.to_rgba_array(c, self._alpha)\r\n    661         self.stale = True\r\n    662 \r\n\r\nC:\\portabel\\miniconda\\envs\\zalando\\lib\\site-packages\\matplotlib\\colors.py in to_rgba_array(self, c, alpha)\r\n    420             result = np.zeros((nc, 4), dtype=np.float)\r\n    421             for i, cc in enumerate(c):\r\n--> 422                 result[i] = self.to_rgba(cc, alpha)\r\n    423             return result\r\n    424 \r\n\r\nC:\\portabel\\miniconda\\envs\\zalando\\lib\\site-packages\\matplotlib\\colors.py in to_rgba(self, arg, alpha)\r\n    374         except (TypeError, ValueError) as exc:\r\n    375             raise ValueError(\r\n--> 376                 \'to_rgba: Invalid rgba arg ""%s""\\n%s\' % (str(arg), exc))\r\n    377 \r\n    378     def to_rgba_array(self, c, alpha=None):\r\n\r\nValueError: to_rgba: Invalid rgba arg ""0.000165462141918""\r\nto_rgb: Invalid rgb arg ""0.000165462141918""\r\ncannot convert argument to rgb sequence\r\n```\r\n\r\nIMO the default (or at least the fallback) should simple take the float array, get min/max and then convert each value to a rgb value depending on the value in `sum_prob`.\r\n\r\n[current mood: why did I start this notebook in python and tried to do this in pandas, cartopy and matplotlib? ggplot would have so much nice defaults... an hour gone to find a way to display a dataframe with x,y,z values on a image, where x,y are every lat-lon combi on a plot but contour/whatever needs it in a non-pandas.dataframe format... the above scatter is actually the workaround...]'"
6226,143595534,peynmurray,tacaswell,2016-03-25 20:53:44,2016-04-30 04:47:59,2016-04-30 04:47:53,closed,tacaswell,1.5.2 (Critical bug fix release),2,confirmed bug,https://api.github.com/repos/matplotlib/matplotlib/issues/6226,b'Issue saving figure as eps when using gouraud shaded triangulation',"b'I\'m running python 3.4 on Debian 8.3, and am using the Qt5Agg backend. When I call savefig() or use the toolbar widget to save a figure that has a gouraud shaded triangulation, I get the following stacktrace:\r\n\r\n```python\r\nTraceback (most recent call last):\r\n  File ""/home/tps/PyCharmProjects/test/test_PlotWindow.py"", line 323, in saveFigRButtonClicked\r\n    savefig(fname)\r\n  File ""/usr/local/lib/python3.4/dist-packages/matplotlib/pyplot.py"", line 688, in savefig\r\n    res = fig.savefig(*args, **kwargs)\r\n  File ""/usr/local/lib/python3.4/dist-packages/matplotlib/figure.py"", line 1565, in savefig\r\n    self.canvas.print_figure(*args, **kwargs)\r\n  File ""/usr/local/lib/python3.4/dist-packages/matplotlib/backends/backend_qt5agg.py"", line 196, in print_figure\r\n    FigureCanvasAgg.print_figure(self, *args, **kwargs)\r\n  File ""/usr/local/lib/python3.4/dist-packages/matplotlib/backend_bases.py"", line 2232, in print_figure\r\n    **kwargs)\r\n  File ""/usr/local/lib/python3.4/dist-packages/matplotlib/backends/backend_ps.py"", line 995, in print_eps\r\n    return self._print_ps(outfile, \'eps\', *args, **kwargs)\r\n  File ""/usr/local/lib/python3.4/dist-packages/matplotlib/backends/backend_ps.py"", line 1023, in _print_ps\r\n    **kwargs)\r\n  File ""/usr/local/lib/python3.4/dist-packages/matplotlib/backends/backend_ps.py"", line 1113, in _print_figure\r\n    self.figure.draw(renderer)\r\n  File ""/usr/local/lib/python3.4/dist-packages/matplotlib/artist.py"", line 61, in draw_wrapper\r\n    draw(artist, renderer, *args, **kwargs)\r\n  File ""/usr/local/lib/python3.4/dist-packages/matplotlib/figure.py"", line 1159, in draw\r\n    func(*args)\r\n  File ""/usr/local/lib/python3.4/dist-packages/matplotlib/artist.py"", line 61, in draw_wrapper\r\n    draw(artist, renderer, *args, **kwargs)\r\n  File ""/usr/local/lib/python3.4/dist-packages/matplotlib/axes/_base.py"", line 2324, in draw\r\n    a.draw(renderer)\r\n  File ""/usr/local/lib/python3.4/dist-packages/matplotlib/artist.py"", line 61, in draw_wrapper\r\n    draw(artist, renderer, *args, **kwargs)\r\n  File ""/usr/local/lib/python3.4/dist-packages/matplotlib/collections.py"", line 1694, in draw\r\n    renderer.draw_gouraud_triangles(gc, verts, colors, transform.frozen())\r\n  File ""/usr/local/lib/python3.4/dist-packages/matplotlib/backends/backend_ps.py"", line 867, in draw_gouraud_triangles\r\n    stream = quote_ps_string(streamarr.tostring())\r\n  File ""/usr/local/lib/python3.4/dist-packages/matplotlib/backends/backend_ps.py"", line 170, in quote_ps_string\r\n    s=s.replace(""\\\\"", ""\\\\\\\\"")\r\nTypeError: expected bytes, bytearray or buffer compatible object\r\n```'"
6212,142998001,madphysicist,tacaswell,2016-03-23 15:47:42,2016-03-26 13:31:15,2016-03-26 03:56:33,closed,tacaswell,2.1 (next point release),2,confirmed bug;Difficulty: Easy,https://api.github.com/repos/matplotlib/matplotlib/issues/6212,b'ENH? BUG? `pyplot.setp`/`Artist.setp` does not accept non-indexable iterables of handles.',"b'Setup\r\n-----\r\n`matplotlib.__version__` = 1.5.1\r\n`matplotlib.__version__numpy__` = 1.6\r\nPython 3.5.1, IPython 4.1.2  running under anaconda\r\nOS: Red Hat 6.5\r\n\r\nMatplotlib installed with `conda install matplotlib`.\r\n\r\nIssue\r\n-----\r\nSupplying an iterable that is not a list or a tuple (or other indexable sequence) causes an issue with `setp`. This is probably OK with Python 2, but it is counter-intuitive for Python 3. I would expect the following to work, but it does not:\r\n\r\n    >>> import matplotlib.pyplot as plt\r\n    >>> import itertools\r\n    >>> lines1 = plt.plot(range(3), range(3), range(5), range(5))\r\n    >>> lines2 = plt.plot(range(4), range(4), range(6), range(6))\r\n    >>> plt.setp(itertools.chain(lines1, lines2), color=\'red\')\r\n    Traceback (most recent call last):\r\n\r\n      File ""<ipython-input-6-2f274dd0d4c1>"", line 1, in <module>\r\n        plt.setp(itertools.chain(lines1, lines2), color=\'red\')\r\n\r\n      File ""/home/jfoxrabi/miniconda3/lib/python3.5/site-packages/matplotlib/pyplot.py"", line 351, in setp\r\n        return _setp(*args, **kwargs)\r\n\r\n      File ""/home/jfoxrabi/miniconda3/lib/python3.5/site-packages/matplotlib/artist.py"", line 1437, in setp\r\n        insp = ArtistInspector(obj)\r\n\r\n      File ""/home/jfoxrabi/miniconda3/lib/python3.5/site-packages/matplotlib/artist.py"", line 1032, in __init__\r\n        if cbook.iterable(o) and len(o):\r\n\r\n    TypeError: object of type \'itertools.chain\' has no len()\r\n\r\nThe expected behavior would be the same as for\r\n\r\n    >>> plt.setp(lines1 + lines2, color=\'red\')\r\n\r\nThis example is a bit contrived to illustrate the issue, but I have a case where I am doing stuff to a bunch of lines from different places, then trying to set a couple of properties on them. Wrapping the iterator I have in `list()` is not a huge problem, but it is unexpected and probably should not be needed.\r\n\r\nThe docs are trivial to update in this case (I have already started a PR), but I will need to trace through a couple of things before I am sure I am sticking `next(iter(x))` instead of `x[0]` in the right place.'"
6173,141646454,madphysicist,tacaswell,2016-03-17 17:11:13,2016-05-16 20:59:50,2016-05-16 20:59:50,closed,,1.5.2 (Critical bug fix release),13,confirmed bug;Difficulty: Easy,https://api.github.com/repos/matplotlib/matplotlib/issues/6173,"b'`linestyle` parameter does not support default cycler through `None`, crashes instead.'","b""Setup\r\n-----\r\n`matplotlib.__version__` = 1.5.1\r\n`matplotlib.__version__numpy__` = 1.6\r\nPython 3.5.1, IPython 4.1.2  running under anaconda\r\nOS: Red Hat 6.5\r\n\r\nMatplotlib installed with `conda install matplotlib`.\r\n\r\nIssue\r\n-----\r\nSupplying `None` (the object, not the string) `linestyle` parameter to `plot` (and possible others) raises an error instead of going through the default cycler for that property. I would expect the following to work, but it does not:\r\n\r\n    >>> import matplotlib.pyplot as plt\r\n    >>> plt.plot(range(5), range(5), linestyle=None)\r\n    ...\r\n    TypeError: object of type 'NoneType' has no len()\r\n\r\nThe expected behavior would be that all lines are drawn 'solid'.\r\n\r\nIf this is something that is worth fixing, I can take a look in a couple of days and maybe add code similar to what is done for the `color` argument. The docs would need to be updated too."""
