issue,id,reporter,closed_by,created_at,updated_at,closed_at,state,assignee,milestone,comments,label_name,url,title,body
joblib/joblib#168,43033387,ogrisel,,2014-09-17 16:27:16,2014-09-17 17:04:39,None,open,,,1,Bug,https://api.github.com/repos/joblib/joblib/issues/168,b'Detect when /dev/shm is size limited',"b""`/dev/shm` is limited to a small size (64MB) by default in docker: https://github.com/docker/docker/pull/4981\r\n\r\nThis is problematic as joblib is using `/dev/shm` when available for temporary memory mapped data in `joblib.Parallel`.\r\n\r\nPossible solutions:\r\n\r\n- stop using `/dev/shm` by default (use the HDD backed '/tmp' folder instead): but first we would we need to check that it's not too size limited either in docker with the default settings\r\n- find a way to detect the size of `/dev/shm` and only use it when large enough\r\n- find a way to catch exceptions caused by small `/dev/shm` and raise an exception with a more informative error message instead (suggesting to set the `JOBLIB_TEMP_FOLDER` to another folder)."""
joblib/joblib#198,63308015,dave1g,,2015-03-20 21:08:21,2015-03-26 09:49:36,None,open,,,2,Bug,https://api.github.com/repos/joblib/joblib/issues/198,b'joblib files not cleaned up from /dev/shm',"b'I incorrectly reported this to scikit https://github.com/scikit-learn/scikit-learn/issues/4430 first as that was the code I was most directly making use of.\r\n\r\nBasically I kicked of a multiprocesses script that ended up copying lots of data around, that data eventually filled up /dev/shm and no further copying was possible, the python processes locked up. I killed them, attempted to restart and /dev/shm was left in a bad state with all these large files sitting there (Is it possible to make sure they don\'t live longer than the process that created them?)\r\n\r\n```\r\n$ ls -lrt /dev/shm/joblib\r\n/dev/shm/joblib_memmaping_pool_64060_189405392:\r\ntotal 13528188\r\n-rw------- 1 general 13852862624 Mar 20 09:09 64060-190150864-190138048-0.pkl_01.npy\r\n-rw------- 1 general 152 Mar 20 09:09 64060-190150864-190138048-0.pkl\r\n```\r\n\r\n4 or 5 similar files/directories were present\r\n\r\n\r\nIf nothing can be done about this situation. It would at least be nice for the exception that gets thrown to be more informative.\r\n\r\n```\r\nTraceback (most recent call last):\r\nFile "".../python/linux/lib/python2.6/site-packages/sklearn/externals/joblib/numpy_pickle.py"", line 240, in save\r\nobj, filename = self._write_array(obj, filename)\r\nFile "".../python/linux/lib/python2.6/site-packages/sklearn/externals/joblib/numpy_pickle.py"", line 203, in _write_array\r\nself.np.save(filename, array)\r\nFile "".../python/linux/lib/python2.6/site-packages/numpy/lib/npyio.py"", line 453, in save\r\nformat.write_array(fid, arr)\r\nFile "".../python2.6/site-packages/numpy/lib/format.py"", line 521, in write_array\r\narray.tofile(fp)\r\nIOError: 1731607818 requested and 502 written\r\n```\r\n\r\n'"
numpy/numpy#5696,63010876,amueller,charris,2015-03-19 15:06:41,2015-03-21 02:04:23,2015-03-21 02:04:23,closed,,,14,,https://api.github.com/repos/numpy/numpy/issues/5696,b'Mean of dtype object array works sometimes',"b""Hi.\r\nWe ran into this at scikit-learn and it is more of an integration/testing issue than anything else.\r\nIt boils down to this expression:\r\n```python\r\nnp.arange(10).astype(object).mean(axis=0)\r\n```\r\nwhich either produces ``4.5`` or raises an error. I'd like to know what causes the error, in which version it is, and how to robustly test for it.\r\nMaybe I'm overlooking something, but testing it on several platforms, what I get is this:\r\n\r\n```\r\nUbuntu 12.04 + Py 2.7.3 + np 1.6.1 == Pass\r\nUbuntu 12.04 + Py 2.6.9 + np 1.6.2 == Pass\r\nUbuntu 12.04 + Py 3.4.3 + np 1.9.2 == Pass\r\n\r\nUbuntu 14.04 + Py 2.7.9 + np 1.8.0 == Fail\r\nUbuntu 14.04 + Py 2.7.9 + np 1.9.2 == Pass\r\n\r\nOSX Yosemite + Py 2.7.6 + np 1.9.0 == Fail\r\nOSX Yosemite + Py 2.7.6 + np 1.9.1 == Fail\r\nOSX Yosemite + Py 2.7.6 + np 1.9.2 == Fail\r\nOSX Yosemite + Py 2.7.9 + np 1.9.2 == Pass\r\n\r\nUbuntu 14.04 + Py 2.7.3 + np 1.6.1 == Pass\r\nUbuntu 14.04 + Py 2.7.6 + np 1.8.0 == Fail\r\nUbuntu 14.04 + Py 2.7.6 + np 1.9.0 == Pass\r\n```\r\nSo even for the same Python and numpy version, the behavior is different between Ubuntu and OS X.\r\n\r\nAny help would be much appreciated.\r\ncc @trevorstephens"""
,,,,,,,,,,,,,,
joblib/joblib#57,10451843,lsartran,,2013-01-30 09:30:22,2015-01-20 18:01:46,None,open,,,1,,https://api.github.com/repos/joblib/joblib/issues/57,b'Filesystem compression breaks joblib.test.test_disk.test_disk_used',"b'Hello, I am getting the following error when running nosetests on the latest version (latest commit dated Jan 15th.)\r\n\r\n`````\r\n======================================================================\r\nFAIL: joblib.test.test_disk.test_disk_used\r\n----------------------------------------------------------------------\r\nTraceback (most recent call last):\r\n  File ""/usr/local/lib/python2.7/site-packages/nose-1.2.1-py2.7.egg/nose/case.py"", line 197, in runTest\r\n    self.test(*self.arg)\r\n  File ""/usr/home/ls/software/joblib/joblib/test/test_disk.py"", line 40, in test_disk_used\r\n    nose.tools.assert_true(disk_used(cachedir) >= target_size)\r\nAssertionError: False is not true\r\n    \'False is not true\' = self._formatMessage(\'False is not true\', ""%s is not true"" % safe_repr(False))\r\n>>  raise self.failureException(\'False is not true\')\r\n    \r\n\r\n----------------------------------------------------------------------\r\nRan 299 tests in 2.890s\r\n\r\nFAILED (failures=1)\r\n````\r\n/tmp is in a ZFS volume on FreeBSD with on-the-fly transparent compression enabled, so disk_used can be smaller than target_size. It indeed is:\r\n\r\n```\r\n[10:14:30] [ls@coyote /tmp]$ dd if=/dev/zero of=test.1M bs=1M count=1\r\n1+0 records in\r\n1+0 records out\r\n1048576 bytes transferred in 0.000609 secs (1721348928 bytes/sec)\r\n[10:14:36] [ls@coyote /tmp]$ ls -al test.1M\r\n-rw-r--r--  1 ls  wheel  1048576 Jan 30 10:14 test.1M\r\n[10:14:39] [ls@coyote /tmp]$ du -k test.1M\r\n1\ttest.1M\r\n[10:14:50] [ls@coyote /tmp]$ du -Ak test.1M\r\n1024\ttest.1M\r\n```\r\n\r\nI\'m unsure about what to suggest, as I don\'t know what the authors meant to check here:\r\n* to get the apparent size of a file, using stat.st_size is the way to go\r\n* however, to get its actual disk usage (to impose a limit upon how much space the cache can use, for instance) stat.st_blocks is fine, but the assumption test_disk_used makes doesn\'t hold.'"
scipy/scipy#3025,21692957,bretter,pv,2013-10-28 14:36:41,2013-11-16 18:28:34,2013-11-09 14:10:43,closed,,0.13.1,7,defect;scipy.ndimage,https://api.github.com/repos/scipy/scipy/issues/3025,b'scipy.ndimage.label() broken in scipy 0.13',"b'I am using Python 3.3.2 on 64-bit Arch Linux.\r\n\r\nI have a script that skeletonizes an image and then i run:\r\nndimage.label(skeletonized_image, np.ones((3, 3)))\r\n\r\nWhen using scipy 0.12, label counts about 30 seperate objects which are clearly disconnected.\r\n\r\nWhen using scipy 0.13, I label generates about twice the amount of objects many of which are clearly connected.\r\n\r\ni.e.\r\n[0, 0, 0, 0;\r\n 1, 1, 2, 2;\r\n 0, 0, 0, 0]\r\n\r\nFor now downgrading to scipy 0.12 has solved the problem.'"
numpy/numpy#5456,54538888,MechCoder,MechCoder,2015-01-16 04:31:41,2015-01-16 18:13:19,2015-01-16 18:13:19,closed,,,4,,https://api.github.com/repos/numpy/numpy/issues/5456,b'BUG? : Inconsistency in slicing of object arrays',"b'I am not sure again if this is the expected behavior or not.\r\n\r\n    In [16]: x1 = [[1], [2, 3]]\r\n    In [17]: b = np.array(x1, dtype=object)\r\n    In [18]: x = np.random.rand(5)\r\n    In [19]: x[b[1]]\r\n    Out[19]: array([ 0.65138485,  0.52464837])\r\n    In [20]: x2 = [[1], [2]]\r\n    In [21]: b = np.array(x2, dtype=object)\r\n    In [22]: x[b[0]]\r\n    ---------------------------------------------------------------------------\r\n    IndexError                                Traceback (most recent call last)\r\n    <ipython-input-22-89c92d26bcc0> in <module>()\r\n    ----> 1 x[b[0]]\r\n\r\n    IndexError: arrays used as indices must be of integer (or boolean) type\r\n    # Should this be a list?\r\n    In [23]: b[0]\r\n    Out[23]: array([1], dtype=object)\r\n\r\n'"
materialsinnovation/pymks#132,52385179,wd15,davidbrough1,2014-12-18 16:26:28,2015-01-12 17:45:39,2015-01-12 17:45:39,closed,,version 0.2,3,bug,https://api.github.com/repos/materialsinnovation/pymks/issues/132,b'GridSearchCV no longer accepting multidimensional features',"b""See GridSearchCV in http://openmaterials.github.io/pymks/rst/cahn_hilliard_Legendre.html as an example of where this is broken. The solution is to subclass GridSearchCV and flatten the array and then wrap the model class dynamically in a new class that unwrap the flatten data passed through GridSearchCV's fit method."""
sphinx-gallery/sphinx-gallery#18,57827251,Titan-C,lesteve,2015-02-16 16:49:58,2016-03-17 15:31:09,2016-03-17 15:31:09,closed,,,0,,https://api.github.com/repos/sphinx-gallery/sphinx-gallery/issues/18,b'Unicode support',"b""I came to notice that if the examples docstring have an unicode character, sphinx-gallery fails in python2. It is not the case if the unicode characters are outside the main docstring, because the encoding header of the file makes the scripts work. The reason the files having my foreign accented name still work.\r\n\r\nthis PR https://github.com/scikit-learn/scikit-learn/pull/3777 didn't help with my issue."""
scipy/scipy#2481,14215555,WarrenWeckesser,rgommers,2013-05-11 01:07:38,2014-04-16 20:50:19,2014-04-16 20:50:19,closed,,0.14.0,2,defect;prio-normal;scipy.sparse,https://api.github.com/repos/scipy/scipy/issues/2481,b'BUG: sparse: todense() fails for coo matrix with dtype np.float16',"b'Example:\r\n\r\n```\r\n>>> coo_matrix([[0]], dtype=np.float16).todense()\r\nTraceback (most recent call last):\r\n  File ""<stdin>"", line 1, in <module>\r\n  File ""/home/warren/local_scipy/lib/python2.7/site-packages/scipy/sparse/base.py"", line 515, in todense\r\n    return np.asmatrix(self.toarray(order=order, out=out))\r\n  File ""/home/warren/local_scipy/lib/python2.7/site-packages/scipy/sparse/coo.py"", line 244, in toarray\r\n    B.ravel(\'A\'), fortran)\r\n  File ""/home/warren/local_scipy/lib/python2.7/site-packages/scipy/sparse/sparsetools/coo.py"", line 175, in coo_todense\r\n    return _coo.coo_todense(*args)\r\nTypeError: Array of type \'float\' required.  Array of type \'char\' given\r\n```\r\n\r\nThis was reported on stackoverflow: http://stackoverflow.com/questions/16492224/python-typeerror-using-scipys-coo-matrix-todense/'"
joblib/joblib#192,60477162,lesteve,GaelVaroquaux,2015-03-10 10:16:09,2015-03-11 07:45:30,2015-03-10 15:13:37,closed,,,10,,https://api.github.com/repos/joblib/joblib/issues/192,b'Fix python 2 and 3 compatibility problems with compressed pickles',b'From https://github.com/scikit-learn/scikit-learn/issues/3596.'
mne-tools/mne-python#1401,37278399,dengemann,dengemann,2014-07-07 15:17:01,2014-08-05 11:00:00,2014-07-07 20:25:13,closed,,,4,,https://api.github.com/repos/mne-tools/mne-python/issues/1401,b'BUG: errors in sklearn CSP',"b'```Python\r\n---------------------------------------------------------------------------\r\nValueError                                Traceback (most recent call last)\r\n/Users/dengemann/github/mne-python/examples/decoding/plot_decoding_csp_eeg.py in <module>()\r\n     93 from sklearn.cross_validation import cross_val_score\r\n     94 clf = Pipeline([(\'CSP\', csp), (\'SVC\', svc)])\r\n---> 95 scores = cross_val_score(clf, epochs_data_train, labels, cv=cv, n_jobs=1)\r\n     96\r\n     97 # Printing the results\r\n\r\n/Users/dengemann/anaconda/lib/python2.7/site-packages/sklearn/cross_validation.pyc in cross_val_score(estimator, X, y, scoring, cv, n_jobs, verbose, fit_params, score_func, pre_dispatch)\r\n   1098         Array of scores of the estimator for each run of the cross validation.\r\n   1099     """"""\r\n-> 1100     X, y = check_arrays(X, y, sparse_format=\'csr\', allow_lists=True)\r\n   1101     if y is not None:\r\n   1102         y = np.asarray(y)\r\n\r\n/Users/dengemann/anaconda/lib/python2.7/site-packages/sklearn/utils/validation.pyc in check_arrays(*arrays, **options)\r\n    253             if array.ndim >= 3:\r\n    254                 raise ValueError(""Found array with dim %d. Expected <= 2"" %\r\n--> 255                                  array.ndim)\r\n    256\r\n    257         if copy and array is array_orig:\r\n\r\nValueError: Found array with dim 3. Expected <= 2\r\n```\r\n@kazemakase @agramfort '"
,,,,,,,,,,,,,,
scipy/scipy#4142,48631914,ogrisel,stefanv,2014-11-13 12:45:14,2014-11-14 09:44:21,2014-11-13 22:12:31,closed,,,4,,https://api.github.com/repos/scipy/scipy/issues/4142,b'BUG: ZeroDivisionError in scipy.sparse.linalg.lsqr',"b""This problem was found as an unstable test in scikit-learn: scikit-learn/scikit-learn#2986.\r\n\r\nThis PR includes a non regression test and a potential fix (adding eps's in the denominators of fractions computed for convergence checks). I don't understand the overall algorithm but I think that those eps should be pretty harmless as they only impact quantities computed for breaking out of the loop, not the solution itself."""
numpy/numpy#4422,28588916,jnothman,,2014-03-02 21:30:50,2015-10-30 02:46:51,None,open,,,3,11 - Bug;component: numpy.ma;priority: normal,https://api.github.com/repos/numpy/numpy/issues/4422,"b'ma.sort(..., endwith=True) broken with nans'","b""A masked array containing `nan` currently sorts such that `nan`s appear at the end of the array, violating `endwith=True`:\r\n```python\r\n>>> m = np.ma.masked_array([np.nan, -1], mask=[0, 1])\r\n>>> m\r\nmasked_array(data = [nan --],\r\n             mask = [False  True],\r\n       fill_value = 1e+20)\r\n>>> m.sort()\r\n>>> m\r\nmasked_array(data = [-- nan],\r\n             mask = [ True False],\r\n       fill_value = 1e+20)\r\n```\r\n\r\nApart from its own contract, this breaks consistency within the current implementation of `np.ma.median` (which should probably not rely on `sort` anyway), returning:\r\n```python\r\n>>> np.ma.median(np.ma.masked_array([np.nan, 5, -1], mask=[0, 0, 1]))\r\n5.0\r\n>>> np.ma.median(np.ma.masked_array([np.nan, 5], mask=[0, 0]))\r\nnan\r\n```\r\n(not that I'm sure what it means to take a median when there are `nan`s present)\r\n\r\nPerhaps `minimum_fill_value` needs an alternative for the `sort` case because of the convention that `nan` comes last."""
joblib/joblib#103,25035638,venuktan,,2014-01-03 21:02:23,2014-04-25 20:42:00,None,open,,,1,,https://api.github.com/repos/joblib/joblib/issues/103,b'sklearn model write to disk and read back from disk using joblib',"b'I am building my model and storing it at a location using \r\n`joblib.dump(model, modelStoreLocation, compress=9)`\r\n\r\nThen in a separate execution I am trying to read the model from the location as show below : \r\n`# loading the model stored on disk\r\nmodel = joblib.load(modelStoreLocation)`\r\n\r\nI get the following error : \r\n```\r\nTraceback (most recent call last):\r\nFile ""/Users/venuktangirala/PycharmProjects/nFlate/compute/prediction/categories/logisticRegression.py"", line 84, in <module>x\r\nprediction = predictDataFrame(dataFrame.ix[600:623, :-1].values, modelStoreLocation)\r\nFile ""/Users/venuktangirala/PycharmProjects/nFlate/compute/prediction/categories/logisticRegression.py"", line 58, in predictDataFrame\r\nprediction = model.predict(dataToPredict)\r\nFile ""/anaconda/lib/python2.7/site-packages/sklearn/linear_model/base.py"", line 223, in predict\r\nscores = self.decision_function(X)\r\nFile ""/anaconda/lib/python2.7/site-packages/sklearn/linear_model/base.py"", line 207, in decision_function\r\ndense_output=True) + self.intercept_\r\nFile ""/anaconda/lib/python2.7/site-packages/sklearn/utils/extmath.py"", line 83, in safe_sparse_dot\r\nreturn np.dot(a, b)\r\nTypeError: can\'t multiply sequence by non-int of type \'float\'\r\n```\r\n\r\nThe same works with out any problem when its in the same execution i.e. build the model , write to dsik and read from disk in the same execution.\r\n\r\nWhat is the fix for this ?'"
mne-tools/mne-python#985,24265958,dengemann,dengemann,2013-12-13 19:09:15,2013-12-20 14:27:54,2013-12-20 14:27:54,closed,,,2,,https://api.github.com/repos/mne-tools/mne-python/issues/985,b'BUG: deal with RandomizedPCA sklearn issue in ICA',b'cf. \r\n\r\nhttps://github.com/scikit-learn/scikit-learn/issues/2663#issuecomment-30507653\r\n\r\nas a consequence our explained variance API is wrong :-(\r\n'
iancze/Starfish#26,126809226,gully,gully,2016-01-15 05:16:03,2016-02-18 05:56:48,2016-02-18 05:56:48,closed,,v0.2.0,6,bug,https://api.github.com/repos/iancze/Starfish/issues/26,"b'""leading minor not positive definite"" in Cholesky decomposition for lnprob calculation'","b'Lately I\'ve been hitting a problem in the Cholesky decomposition step during `star.py --sample=ThetaPhi`\r\n\r\n```python\r\n  File ""/anaconda/lib/python3.4/site-packages/emcee/sampler.py"", line 116, in get_lnprob\r\n    return self.lnprobfn(p, *self.args, **self.kwargs)\r\n  File ""/Users/gully/GitHub/Starfish/Starfish/parallel.py"", line 696, in lnfunc\r\n    lnp = self.evaluate()\r\n  File ""/Users/gully/GitHub/Starfish/Starfish/parallel.py"", line 297, in evaluate\r\n    factor, flag = cho_factor(CC)\r\n  File ""/anaconda/lib/python3.4/site-packages/scipy/linalg/decomp_cholesky.py"", line 132, in cho_factor\r\n    check_finite=check_finite)\r\n  File ""/anaconda/lib/python3.4/site-packages/scipy/linalg/decomp_cholesky.py"", line 30, in _cholesky\r\n    raise LinAlgError(""%d-th leading minor not positive definite"" % info)\r\nnumpy.linalg.linalg.LinAlgError: 2-th leading minor not positive definite\r\n```\r\n\r\nAt first I thought I had too large of a covariance kernel and the fits were going crazy.  I looked into it and I\'m guessing it\'s a subtle type of roundoff error, based on [this issue from scikit-learn](https://github.com/scikit-learn/scikit-learn/issues/2640).  The issue and affiliated pull request shows how to work around it, I think.\r\n\r\nThere could be other problems at play, so I am still experimenting.  I\'ll post what I find out.'"
mne-tools/mne-python#3425,165893832,kingjr,,2016-07-15 23:15:08,2016-07-25 22:59:53,None,open,,0.13,44,,https://api.github.com/repos/mne-tools/mne-python/issues/3425,b'MRG: Refactor Xdawn',"b'* Refactor: Xdawn and XdawnTransformer classes, now both in `mne.preprocessing.xdawn`\r\n* FIX: bug weird channels picking in tests and Xdawn class\r\n* FIX: unstable unit test\r\n* FIX: remove undocumented attributes (e.g. `Xdawn.exclude`), add and document necessary ones (`Xdawn.overlap_`, `evokeds_`, `.event_id_`)\r\n* ENH: `_xdawn_fit` private function for more explicit args.\r\n* FIX: `XdawnTransformer` devoid of any fancy objects (Evoked / dictionary etc), and only uses numpy\r\n\r\ncc @kaichogami @alexandrebarachant @dengemann '"
MichelleLochner/supernova-machine#6,58090652,mkerrwinter,,2015-02-18 16:27:51,2015-02-18 16:27:51,None,open,,,0,,https://api.github.com/repos/MichelleLochner/supernova-machine/issues/6,b'Using GridSearch with KNN',"b""Hey, I'm trying to optimise KNN with grid_search, but for some obscure reason grid_search can't handle KNN with the Mahalanobis distance metric. This problem is described here:\r\nhttps://github.com/scikit-learn/scikit-learn/issues/2609\r\nand they say they've fixed it. So how do I get their new code where the problem's fixed? \r\nThanks!"""
numpy/numpy#4012,22110190,ankit-maverick,charris,2013-11-05 10:09:29,2014-02-24 14:48:56,2014-02-24 14:48:56,closed,,,3,,https://api.github.com/repos/numpy/numpy/issues/4012,b'Inconsistent behaviour of np.ma.median',"b'The correct mask of the masked_array returned by np.ma.median in the following case should be `[False False]`. Can someone confirm this? This blocks https://github.com/scikit-learn/scikit-learn/issues/2560\r\n\r\n```py\r\nIn [1]: import numpy as np\r\n\r\nIn [2]: a = np.arange(20).reshape(10,2).astype(np.float)\r\n\r\nIn [3]: a[3,1] = np.nan\r\n\r\nIn [4]: a[5,0] = np.nan\r\n\r\nIn [5]: mask = a == np.nan\r\n\r\nIn [6]: masked_a = np.ma.masked_array(a, mask=mask)\r\n\r\nIn [7]: median_masked = np.ma.median(masked_a, axis=0)\r\n\r\nIn [8]: median_masked\r\nOut[8]: \r\nmasked_array(data = [ 10.  12.],\r\n             mask = False,\r\n       fill_value = 1e+20)\r\n\r\nIn [9]: mean_masked = np.ma.mean(masked_a, axis=0)\r\n\r\nIn [10]: mean_masked\r\nOut[10]: \r\nmasked_array(data = [-- --],\r\n             mask = [ True  True],\r\n       fill_value = 1e+20)\r\n```'"
